"ID","Lemma (RegEx)","Regulärer Ausdruck","Text","Lemma (Latincy)"
"EDCS-16100746","nepos","nepo(s|ti|te|tum)","Imperator Caesar Marcus Aurelius Antoninus Augustus Armeniacus pontifex maximus tribunus potestate XIX  imperator III consul III et Imperator Caesar Lucius Aurelius Verus Augustus Arme niacus Parthicus maximus tribunicia potestate V  imperator III consul II proconsul divi Antonini filii divi Hadriani nepotes di vi Traiani Parthici pronepotes divi Nervae abnepotes  abnepotes peditibus et equitibus qui mili taverunt in cohorte I Flavia Numida rum quae est Lyciae Pamphyliae sub Iulio Modesto proconsule quinque et vigin ti stipendiis emeritis dimissis honesta missione","pronepos"
"EDCS-28701290","nepos","nepo(s|ti|te|tum)","Imperatori Caesari Lucio Sep timio Severo Pio Pertinaci Augusto Arabico Adiabenico Parthico maximo divi Marci filio divi Commodi fratri divi Antonini Pii nepoti divi Hadriani pronepoti divi Traiani Parthici abnepoti divi Nervae adnepoti imperatori XI tribunicia potestate VI consuli II proconsuli et Imperatori Marco Aurelio Antonino Augusto Luci Septimi Severi Pii Pertinacis Augusti nostri filio divi Antonini nepoti divi Antonini Pii pronepoti divi Hadriani abnepoti divi Traiani Parthici et divi Nervae adnepoti et   curante Tiberio Claudio Claudiano legato Auggustorum pro praetore ab Aquinco milia passuum  ","nepos"
"EDCS-26100142","nepos","nepo(s|ti|te|tum)","Imperatori Caesari Marco Anton io Gordia no Pio Fel ici Augusto divorum Gordianorum nepoti","nepos"
"EDCS-46400025","nepos","nepo(s|ti|te|tum)","Imperator Caesar divi Hadriani filius divi Traiani Parthici nepos divi Nervae pronepos Titus Aelius Hadrianus Antoninus Augustus Pius pontifex maximus tribunicia potestate V consul III pater patriae equitibus et peditibus qui militaverunt in alis II et cohortibus VI quae appellantur  lt G=C gt aetulorum veterana et   Ulpia dromadariorum Palmyrenorum |miliaria et I Augusta Thracum et I Thracum civium Romanorum et I Hispanorum Cyrenaica et I Aelia classica et II Aure lia classica et VI Hispanorum et sunt in Ara bia sub Aemilio Caro quinis et vicenis pluribusve stipendiis emeritis dimissis honesta missione quorum nomina subscripta sunt civitatem Romanam qui eorum non haberent dedit et conubium  Imperator Caesar divi Hadriani filius divi Traiani Parthici nepos divi Nervae pronepos Titus Aelius Hadrianus Antoninus Augustus Pius pontifex maximus tribunicia potestate V consul III pater patriae equitibus et peditibus qui militaverunt in alis II et cohortibus VI quae appellantur Gaetulorum veterana et I Ulpia dromadariorum Palmyrenorum |miliaria et I Augusta Thracum et I Thracum civium Romanorum et I Hispanorum Cyrenaica et I Aelia classica et II Aurelia classica et VI Hispanorum et sunt in Arabia sub Aemilio Caro quinis et vicenis pluribusve stipendiis emeritis dimissis honesta missione quorum nomina subscripta sunt civitatem Romanam qui eorum non haberent dedit et conubium cum uxoribus quas tunc habuissent cum est civitas iis data aut cum iis quas postea duxissent dumtaxat singulis","nepos"
"EDCS-17300242","nepos","nepo(s|ti|te|tum)","Traiani Parthici nepoti divi Nervae pronepoti Tito Aelio Hadriano Antonino Augusto Pio     cives et incolae   aere conlato","pronepotus"
"EDCS-05000734","nepos","nepo(s|ti|te|tum)","Nero Claudius divi Claudi filius Germanici Cae saris nepos Tiberi Caesaris Augusti pronepos divi Augusti abnepos Caesar Augustus Germanicus pontifex maximus tribunicia potestate VI  pater patriae consul III  vias faciendas curavit per Titum Iulium Ustum procura torem provinciae Thraciae milia passuum CXI ","pronepos"
"EDCS-46300249","nepos","nepo(s|ti|te|tum)","Imperatori Caesari Marco Aurelio Severo Antonino Pio Felici Augusto divi Septimi Severi Pii Arabici Adiabenici Parthici maximi Britannici maximi Augusti et Iuliae Domnae Augustae matris cas trorum et senatus et patriae filio divi Marci Antonini Pii Germanici Sarmatici nepoti divi Antonini Pii pronepoti divi Hadriani abnepoti divi Traiani Parthici et divi Nervae adnepoti Parthico maximo Britannico Germanico maximo pontifici maximo tribunicia potestate XVIII imperatori III consuli IIII patri patriae proconsuli res publica Sitifensium Nerviana Antoninianorum miliaria constituit","pronepotus"
"EDCS-22000461","nepos","nepo(s|ti|te|tum)","Dis Manibus Iuliae O spitae vixit annos LXXX  Caius Caecilius Ro gatianus nepos aviae","nepos"
"EDCS-36600058","nepos","nepo(s|ti|te|tum)"," postea duxissent dumtaxat singulis ante diem VIIII Kalendas Maias Lucio Roscio Aeliano Cnaeo Papirio Aeliano consulibus cohortis I Antiochensium sagittariorum cui praeest Lucius Caelius Sa  ex pedite Antipatro Her  descriptum et recognitum ex tabula aenea quae fixa est Romae in muro post templum divi Augusti ad Minervam  Imperator Caesar divi Hadriani filius divi Traiani nepos divi Nervae pronepos Titus Aelius Hadrianus Antoninus Augustus Pius pontifex maximus tribunicia potestate XX imperator II consul IIII pater patriae equitibus et peditibus qui militaverunt in alis II quae appellantur I Claudia Nova miscellanea et Gallorum Flaviana et cohortibus X V Gallorum et Pannoniorum et V Hispanorum et I Montanorum et I Antiochensium sagittariorum et I Cretum sagittariorum et III Campestris II Gallorum Macedonica  et III Brittonum veterana et Lusitanorum et I Pannoniorum veteranaet sunt in Moesia superiore sub Curtio Iusto legato XXV stipendiis emeritis dimissis honesta missione quorum nomina subscripta sunt","nepos"
"EDCS-05100454","nepos","nepo(s|ti|te|tum)","Vivus fecit Caius Plinius Calvos  VIvir sibi et Plinis Successae uxori Chrysiadi et Successori filiis Lucio Casticio Luci filio Oufentina Catullo IIIIviro aedilicia potestate genero Lucio Casticio Luci filio Oufentina Maximo nepoti Plinis Tharsae et Verecundae patronis Plinio Cerdoni fratri Plinio Phaenomeni amico","nepos"
"EDCS-14500542","avia","avia","Dis Manibus Flavia Valeria Aurelio Adiutori civi Afro negotianti obito annorum XXXV coniugi karissimo titulum posuit","Flavia"
"EDCS-23400951","avia","avia","Dis Manibus Flavius Felix et Flaviae Nepotianae coniugi et filius suis libertis libertabusque posterisque eorum quod si quis voluerit vendere sive corpus ponere inferre da lt b=V gt it aerarium Saturni HS CCLmilia","Flavias"
"EDCS-51600780","avia","avia","Imperator Caesar divi Traiani Parthici filius divi Ner vae nepos Traianus Hadrianus Augustus pontifex maximus tribunicia potestate V consul III proconsul equitibus et peditibus qui militaverunt in alis tribus et cohortibus novem quae appellantur I Gallorum et Pannoniorum et I Flavia Gaetulorum et II Hispanorum Aravacorum et I Claudia Sugambrorum veterana  et I Lusitanorum Cyrenaica et   et I Germanorum et   I Lepidiana civium Romanorum et  I Lepidiana civium Romanorum et II Chalcidenorum sagittaria et II Lucensium et II Flavia Brittonum et sunt in Moesia inferiore sub Ummidio Quadrato quinis et vicenis pluribusve stipendiis emeritis dimissis honesta missione quorum nomina subscripta sunt ipsis liberis posterisque civitatem dedit et conubium cum uxoribus quas tunc habuissent cum est civitas iis data aut si qui caelibes essent cum iis quas postea duxissent dumtaxat singuli singulas","Flavia"
"EDCS-14803570","avia","avia","Dis Manibus sacrum Usenae Licentiae fecit Titus Flavius Augusti libertus Vitalis uxori optimae et Flavia Vitalis filia matri suae carissimae","Flavia"
"EDCS-10200488","avia","avia","Dis Manibus Flaviae Athenaidi vixit annis VIII mense I diebus XVII Flavia Horea filiae dulcissimae fecit","Flavia"
"EDCS-10200592","avia","avia","Dis Manibus Flaviae Paoniae","Flavias"
"EDCS-28000080","avia","avia","Q Tamacuo Flavia Marina uxor viva fecit","Flavia"
"EDCS-05800787","avia","avia","Flavia Titi filia Variane ob merita Crescentis Augustorum liberti patris eius qui omnes honores municipii nostri delatos sibi sincera fide gessit decuriones populusque","Flavia"
"EDCS-00600690","avia","avia","Dis Manibus Faenia Luci filia Syntyche sibi et Lucio Faenio Carpo patri Faeniae Luci libertae Helpidi matri Lucio Faenio Ianuario fratri Lucio Faenio Ceriali fratri Faeniae LLuciorum |mulieris libertae Syntyche aviae Lucio Faenio Euhelpisto liberto Pio Caio Mucio Pietati avo suo posterisque eorum","avia"
"EDCS-12300310","avia","avia","Imperator Caesar divi Hadriani filius divi Traiani Parthici nepos divi Nervae pronepos Titus Aelius Hadrianus Antoninus Augustus Pius pontifex maximus tribunicia potestate XX imperator II consul IIII pater patriae equitibus et peditibus qui militaverunt in alis IIII quae appellantur   et Thracum Herculiana et I Ulpia singularium et I Ulpia dromadariorum |miliaria et cohortibus XVI I Ulpia Dacorum et I Ulpia Petraeorum et I Augusta Pannoniorum et I Claudia Sugambrorum et I Ascalonitarum sagittaria et I Flavia Chalcidenorum et II Ulpia equitata et II Italica civium Romanorum et II Ulpia Paphlagonum et II Thracum Surica et II classica sagittaria et III Ulpia Paphlagonum et III Augusta Thracum et IV Callaecorum et V Ulpia Petraeorum et VII Gallorum et sunt in Suria sub Attidio Corneliano legato XXV pluribusve stipendiis emeritis dimissis honesta missione quorum nomina subscripta sunt civitatem Romanam qui eorum non haberent dedit et conubium cum uxoribus quas tunc habuissent cum est civitas iis data aut cum iis quas postea duxissent dumtaxat singulis  Imperator Caesar divi Hadriani filius divi Traiani Parthici nepos divi Nervae pronepos Titus Aelius Hadrianus Antoninus Augustus Pius pontifex maximus tribunicia potestate XX imperator II consul IIII pater patriae equitibus et peditibus qui militaverunt in alis IIII quae appellantur   et Thracum Herculiana et I Ulpia singularium et I Ulpia dromadariorum |miliaria et cohortibus XVI I Ulpia Dacorum et I Ulpia Petraeorum et I Augusta Pannoniorum et I Claudia Sugambrorum et I Ascalonitarum sagittaria et I Flavia Chalcidenorum et II Ulpia equitata et II Italica civium Romanorum et II Ulpia Paphlagonum et II Thracum Surica et II classica sagittaria et III Ulpia Paphlagonum et III Augusta Thracum et IV Callaecorum et   Ulpia Petraeorum et VII Gallorum et sunt in Suria sub Attidio Corneliano legato quinis et vicenis pluribusve stipendiis emeritis dimissis honesta missione quorum nomina subscripta sunt civitatem Romanam qui eorum non haberent dedit et conubium cum uxoribus quas tunc habuissent cum est civitas iis data aut cum iis quas postea duxissent dumtaxat singuli ante diem IV Caio Iulio Orfitiano Caio Caelio Secundo consulibus alae I Ulpiae singularium cui praeest  n  N","Flavia"
"EDCS-18500075","avus","av(us|i|o|um)","Dis Manibus Decimius Auguri nus miles cohortis I praetoriae |centuria Martini vixit annos XXX militavit annos VIII natione Af er Claudia Nunna coniunx et heres bene merenti","milito"
"EDCS-05400480","avus","av(us|i|o|um)","Imperatori Caesari Augusto divi filio pontifici max lt i=U gt mo tribunicia potestate XV imperatori XIII patri patriae Marcus Iulius regis Donni filius Cottius praefectus civitatium quae subscriptae sunt Segoviorum Segusinorum Belacorum Caturigum Medullorum Tebaviorum Adanatium Savincatium Ecdiniorum Veaminiorum Venisamorum Iemeriorum Vesubianiorum Quadiatium et civitates quae sub eo praefecto fuerunt  Imperatori Caesari Augusto divi filio pontifici max lt i=U gt mo tribunicia potestate XV imperatori XIII Marcus Iulius regis Donni filius Cottius praefectus civitatium quae subscriptae sunt Segoviorum Segusinorum Belacorum Caturigum Medullorum Tebaviorum Adanatium Savincatium Ecdiniorum Veaminiorum Venisamorum Iemeriorum Vesubianiorum Quadiatium et civitates quae sub eo praefecto fuerunt","Savincatius"
"EDCS-10200213","avus","av(us|i|o|um)","Dis Manibus Titus Flavius Cerialis Flaviae Philaenidi libertae idem et coniugi bene merenti fecit","Flavius"
"EDCS-28900486","avus","av(us|i|o|um)","Egnatia |mulieris libertae Egloge et  Lucio Epidio Primo Publius Antonius Acho ristus faciendum curavit","curo"
"EDCS-08800001","avus","av(us|i|o|um)","Tiberius Claudius Caesar Augustus Germanicus pontifex maximus tribunicia potestate X imperator XXI pater patriae censor consul V dedit  Caius Rutilius Secundus   posuit idemque dedicavit","dedico"
"EDCS-23702539","avus","av(us|i|o|um)","Dis Manibus sacrum Octaviae Pri migeniae ma tri optimae posuit Gaetuli cus filius terra tibi  lt l=I gt evis sit vixit annos LX","Octavia"
"EDCS-19101222","avus","av(us|i|o|um)","Octavia Erotis","Octavia"
"EDCS-55702090","avus","av(us|i|o|um)","Comini a Quinti liberta avi a in fronte pedes XII","avus"
"EDCS-19301259","avus","av(us|i|o|um)","Eucharis Liciniae liberta docta erodita omnes artes virgo vixit annos XIIII heus oculo errante quei aspicis leti domus morare gressum et titulum nostrum perlege amor parenteis quem dedit natae suae ubei se reliquiae conlocarent corporis hic viridis aetas cum floreret artibus crescente et aevo gloriam conscenderet properavit hora tristis fatalis mea et denegavit ultra veitae spiritum docta erodita paene Musarum manu quae modo nobilium ludos decoravi choro et Graeca in scaena prima populo apparui en hoc in tumulo cinerem nostri corporis inf lt e=I gt stae Parcae deposierunt carmine studium patronae cura amor laudes decus silent ambusto corpore et leto tacent reliqui fletum nata genitori meo et antecessi genita post leti diem bis hic septeni mecum natales dies tenebris tenentur Ditis aeterna domu rogo ut discedens terram mihi dicas levem","decoro"
"EDCS-12300250","avus","av(us|i|o|um)","Imperator  lt C=T gt aesar divi Nervae filius Nerva Traianus Augustus Germanicus  lt p=F gt ontifex maximus tribunicia potestate IIII pater patriae consul III equitibus et peditibus qui militant in alis tribus et cohortibus viginti et una quae appellantur  lt p=I gt raetoria et I Claudia nova et II Pannoniorum et I F lt l=I gt avia Bessorum et I Th racum civium Romanorum et I F lt l=I gt av lt i=L gt a Hispanorum |miliaria et I An tiochensium et I Lusitanorum et I Mo lt n=V gt ta norum civium Romanorum et I Cisipadensium et I Cretum et I Vindelicorum |miliaria civium Romanorum et I Thracum Siria ca  et I Cilicum et II Hispanorum et II Gallo rum Macedonica et II Brittonum |miliaria civium Romanorum Pia Fidelis et II Flavia Commagenorum et III Brittonum et IIII Ra lt e=F gt torum et V Gallorum et V Hispano rum et VI Thracum et VII Breucorum  lt c=F gt ivium Romanorum et su nt in Moesia superiore sub Caio Cilnio Proculo  item dimissis honesta m lt i=T gt ss lt i=T gt one qui qui na et v lt i=T gt cena plurave st lt i=T gt pend lt i=T gt a meruerunt quorum nom lt i=T gt na subscr lt i=T gt pta sunt ips lt i=T gt s l lt i=T gt beris posterisque eorum civitatem dedit et conubium cum uxoribus quas tunc habuis sent cum est civitas iis da lt t=I gt a aut si qui cae libes essent cum iis quas postea duxisse nt dumtaxat s lt i=T gt nguli singulas ante diem VIII Idus Maias Tito Pomponio Mamiliano Herennio Saturnino consulibus cohortis I Antiochensium cui praeest Marcus Calpurnius Sabinus pediti Sapiae Sarmosi filio Anazarbo descriptum et recognitum ex tabula aenea quae fixa est Romae in muro post templum divi Augusti ad Minervam  Imperator Caesar divi Nervae filius Nerva Traianus Augus tus Germanicus pontifex maximus tribunicia potestate IIII pater patriae consul III equitibus et peditibus qui militant in alis tribus et cohortibus viginti et una quae appellantur praetoria et I Claudia nova et II Pannoniorum et I Flavia Bessorum et I Thracum civium Romanorum et I Flavia His panorum |miliaria et I Antiochensium et I Lusitanor um et I Montanorum civium Romanorum et I Cisipadensium et I Cretum et I Vindelicorum |miliaria civium Romanorum et I Thracum Sy riaca et I Cilicum et II Hispanorum et II Gallor um Macedonica et II Brittonum |miliaria civium Romanorum Pia Fidelis et II Fla via Commagenorum et III Brittonum et IIII Raeto rum et V Gallorum et V Hispanorum et VI Thracum et VII Breucorum civium Romanorum et sunt in Moesia superiore sub Caio Cilnio Proculo item dimissis honesta mis sione qui quina et vicena plurave stipendia me ruerunt quorum nomina subscripta sunt ipsis liberis posterisque eorum civitatem dedit et conubium cum uxoribus quas tunc habuissent cum est civitas iis data aut si qui caelibes essent cum iis quas postea duxissent dumtaxat singu li singulas ante diem VIII Idus Maias Tito Pomponio Mamiliano Lucio Herennio Saturnino consulibus cohortis I Antiochensium cui praeest Marcus Calpurnius Sabinus pediti Sapiae Sarmosi filio Anazarbo descriptum et recognitum ex tabula aenea quae fixa est Romae in muro post templum divi Augusti ad Minervam  Quinti Pompei Homeri Auli Ampi Epaphroditi Tiberi Claudi Vitalis Cai Iuli Aprilis Cai Vettieni Modesti Luci Pulli Verecundi Luci Pulli Sperati","auia"
"EDCS-14600009","avunculus","avuncul","Cupitus Quinti filius patri fecit et Maturo avunculo","auunculus"
"EDCS-44800184","avunculus","avuncul","XXIII  antus   avunculo   P","auunculus"
"EDCS-10500939","avunculus","avuncul","Dis Manibus Cacuroni Sattonis Treveri annorum XVII Senilis avunculus","avunculus"
"EDCS-01600176","avunculus","avuncul","Aurelius Moca militavit in cohorte Claudia miliarense annis VIII factus beneficiarius tribuni annis III  inde translatus in legionem Augustam  factus signifer annis XII natus in Dardania vico Zatidis dedit nom en militiae annorum XXIII vixit annis LV Aurelius Maximi anus nep lt o=U gt s avunculo merenti","auunculus"
"EDCS-05500837","avunculus","avuncul","Dis Manibus sacrum Se lt c=Q gt undus Quinto avunculo meo Limico pro meritis posuit annorum XL hic situs est sit tibi terra levis","auunculus"
"EDCS-10500939","avunculus","avuncul","Dis Manibus Cacuroni Sattonis Treveri annorum XVII Senilis avunculus","avunculus"
"EDCS-21000049","avunculus","avuncul","  Tuccius Marci filius Titi nepos  Arruntius Vibia Cai filia Secunda Tucci Vibius Primus socer Vibiae Antiochidi   Arruntio Rufo Tucciano avunculo Primigenio Primi filio vixit annos XVI  Vibiae Cai filiae Soteridi","auunculus"
"EDCS-12401846","avunculus","avuncul","Marco Aedio  Marci filio Teretina Celeri Xviro stlitibus iudicandis quaestori Marci Furi Camilli consulis legat lt o=US gt  miss lt o=US gt  a divo Augusto cum Aulo Plautio in Apuliam ad servos  torquendos aedili Cerialis praetori legato Marci Grani avunculi sui   provincia Bithynia legato Camilli in provincia Africa proconsuli provinciam Cretam et Cyrenas sorte obtinuit legato Marciani consobrini sui in provincia Hispania ulteriore","avunculus"
"EDCS-25300306","avunculus","avuncul","Manliae Luci filiae Secundillae sorori fra trum et avunculorum egregiorum virorum et equitum Romanorum Quintus Herennius Rufus mari tus eques Romanus et Severa filia eorum posuerunt","avunculus"
"EDCS-24400150","avunculus","avuncul","Quinto Iulio Maximo Demetriano egregiae memoriae viro fisci advocato XLquadragesimae Galliarum procuratori XXvicesimae hereditatium per Umbriam et Tusci am praefecto vehiculorum per Belgicam et duas Germanias singularis in tegritatis viro patrono publico Lucius Munatius Saturninus avunculo loco ab or dine impetrato sua pecunia posuit","auunculus"
"EDCS-14803627","patruus","patru(us|i|o|um)","Zosimo Zosimus Soterichus Florentina patruo Secunda soror pientissimo fecerunt","patruus"
"EDCS-24700847","patruus","patru(us|i|o|um)","Dis Manibus Caio Semproni o Modesto patruo vi xit annos LXIII","patruus"
"EDCS-08700939","patruus","patru(us|i|o|um)"," Marco Pupio Quieto patruo","patruus"
"EDCS-23100010","patruus","patru(us|i|o|um)","Divo Commodo divi Marci Antonini Pii Germanici Sarmatici filio fratri Imperatoris Caesaris Luci Septimi Seve ri Pii Pertinacis Augusti Ara bici Adiabenici Parthici maximi pontificis maximi tribunicia potestate XVII imperatoris XI consulis III proconsulis propaga toris imperii fortissimi feli cissimique principis patruo Imperatoris Caesaris Marci Aureli An tonini Pii Felicis Augusti pontificis maximi tribunicia potestate XII consulis III proconsulis fortissimi fe licissimique PR «principis» «et super omnes prin» «cipes nobilissimi» civitas Nattabutum","patruus"
"EDCS-23100010","patruus","patru(us|i|o|um)","Divo Commodo divi Marci Antonini Pii Germanici Sarmatici filio fratri Imperatoris Caesaris Luci Septimi Seve ri Pii Pertinacis Augusti Ara bici Adiabenici Parthici maximi pontificis maximi tribunicia potestate XVII imperatoris XI consulis III proconsulis propaga toris imperii fortissimi feli cissimique principis patruo Imperatoris Caesaris Marci Aureli An tonini Pii Felicis Augusti pontificis maximi tribunicia potestate XII consulis III proconsulis fortissimi fe licissimique PR «principis» «et super omnes prin» «cipes nobilissimi» civitas Nattabutum","patruus"
"EDCS-23100010","patruus","patru(us|i|o|um)","Divo Commodo divi Marci Antonini Pii Germanici Sarmatici filio fratri Imperatoris Caesaris Luci Septimi Seve ri Pii Pertinacis Augusti Ara bici Adiabenici Parthici maximi pontificis maximi tribunicia potestate XVII imperatoris XI consulis III proconsulis propaga toris imperii fortissimi feli cissimique principis patruo Imperatoris Caesaris Marci Aureli An tonini Pii Felicis Augusti pontificis maximi tribunicia potestate XII consulis III proconsulis fortissimi fe licissimique PR «principis» «et super omnes prin» «cipes nobilissimi» civitas Nattabutum","patruus"
"EDCS-04202979","patruus","patru(us|i|o|um)","Publio Octavio Publi filio Verecundo pontifici sacrorum aedium Capito patruus","patruus"
"EDCS-01400017","patruus","patru(us|i|o|um)","Cai Mercuseni Saturnini Lucius Iulius Blastus patruus permissu patronarum ","patruus"
"EDCS-09800229","patruus","patru(us|i|o|um)","Publio Licinio Marci filio Macrino Publius Licinius Luci filius Blaesus patruo","patruus"
"EDCS-28900055","patruus","patru(us|i|o|um)"," liberta    patruino      IVHS","patruinus"
"EDCS-09202143","uxor","uxor","Dis Manibus Iuliae Calli tyche Lucius Cor nelius Vitalis opt lt i=U gt mae uxori","uxor"
"EDCS-23801396","uxor","uxor","Caio Sergio Cai filio   Antistia Cai filia uxor et Caio Sergio Cai filio Papiria Ven  Sextiliae   Caio  Sergio  ","uxor"
"EDCS-14900165","uxor","uxor","Titus Flavius Se cundus filius fecit Tito Flavio Secun do patri pio militavit annos XXXIII vixit annos CX hic situs est Flaviae Urbanae matri piae vixit annos CV hic sita est Flaviae Secundae so rori piae vixit annos XX hic sita est Tito Flavio Marcello fra tri pio vixit annos XX hic situs est Tito Flavio Martiali fratr i militavit annos XII vixit annos XXXV hic situs est Flaviae Speratae soro ri piae vixit annos XXXVI hic sita est Aemiliae Sexti filiae Pacatae uxori piae flaminicae perpetuae vixit annos LIII hic sita est Titus Flavius Titi filius Papiria Secundus ipse flamen perpetuus vixit annos LX hic situs est Flaviae Titi filiae Pacatae fla minicae perpetuae coloniae The leptae filiae piae Flavia Libera ma ter statuam posuit vixit annos XV menses X hic sita est Flavia Libera Titi Flavi Secundi uxor pia vixit annos LXXXVIII hic sita est","uxor"
"EDCS-14805163","uxor","uxor","Titus Statius Titi filius Stati nepos aedilis quaestor Annia Anni filia uxor","uxor"
"EDCS-04201976","uxor","uxor","Quintus Clodius Quinti libertus Maro Quintus Clodius Quinti filius uxor posuit Trebia Marci filia Secunda","uxor"
"EDCS-28400832","uxor","uxor","Lucius Manius Plocamus fecit sibi et Cle lt o=V gt patrae uxori suae","uxor"
"EDCS-09201719","uxor","uxor","Dis Manibus IIIIIIviri Augustalis Quinti Magi Zosimi et Pompeiae Acerroniae uxoris et Fabiae Helpidis Epitychanus libertus et heres","uxor"
"EDCS-09302261","uxor","uxor","Dis Manibus Lucius Rusticani us Boethos Cati ae Iulinae uxori piissimae fecit","uxor"
"EDCS-12100816","uxor","uxor","Imperator Caesar divi Hadriani filius divi Traiani Parthici nepos divi Nervae pronepos Titus Aelius Hadrianus Antoninus Augustus Pius pontifex maximus tribunicia potestate II consul II pater patriae iis qui militaverunt in classe praetoria Misenensi quae est sub Caecio Severo senis et vicenis pluribusve stipendiis emeritis dimissis honesta missione quorum nomina subscripta sunt ipsis liberis posterisque eorum civitatem dedit et conubium cum uxoribus quas nunc habent cum iis civitas datur aut si qui caelibes sunt cum is quas postea duxerint dumtaxat singuli singulas Idibus Februariis Imperatore Tito Aelio Caesare Antonino Augusto Pio II Caio Bruttio Praesente II consulibus ex gregale Marco Lollio Lolli filio Neoni Laerta ex Pam phylia descriptum et recognitum ex tabula aerea quae fixa est Romae in muro post templum divi Augusti ad Minervam  Imperator Caesar divi Hadriani filius divi Traiani Parthici nepos divi Nervae pronepos Titus Aelius Hadrianus Antoninus Augustus Pius pontifex maximus tribunicia potestate II consul II pater patriae iis qui militaverunt in classe praetoria Misenensi quae est sub Caecio Severo senis et vicenis pluribusve stipendiis emeritis dimissis honesta missione quorum nomina subscripta sunt ipsis liberis posterisque eorum civitatem dedit et conubium cum uxoribus quas nunc habent cum iis civitas datur aut si qui caelibes sunt cum is quas postea duxerint dumtaxat singuli singulas  Idibus Februariis Antonino Augusto Pio et Praesente II consulibus ex gregale Marco Lollio Polli filio Neoni Laerta ex Pamphylia  Tiberi Claudi Menandri Publi Atti Severi Luci Pulli Daphni Publi Atti Festi Titi Flavi Romuli Tiberi Iuli Felicis Cai Iuli Silvani","uxor"
"EDCS-20402289","uxor","uxor","Caius Egnatius Primigenius Apollinaris sibi et suis Marcus Helmonius Atticus Apollinaris sibi et Eloniae Hecate uxori et Marco Helmonio Marci filio Tauro filio et libertis libertabusque vivi fecerunt","uxor"
"EDCS-18100618","maritus","marit(us|i|o|um)","Dis Manibus Aeliae Auli filiae Valerianae vixit annos XXIIII menses II dies II et Aulo Aelio  Auli liberto Valeriano scribae librario quaestorio III decuriarum   marito eius   Auli filio Pupinia Aemiliano scribae librario quaestorio III decuriarum patri et   Aeliae Briseidi matri eius et filiis posterisque eorum Aemilianus et Valerianus solum emerunt et ","maritus"
