"ID","Lemma (RegEx)","Regulärer Ausdruck","Text","Lemma (Latincy)"
"EDCS-18800013","mater","mat(er|ri|rum|re)","Dis Manibus Agathemero Augusti liberto fecerunt Asia coniugi suo bene merenti et Panthagathus Caesaris nostri servus aqua rius magistro bene merenti et Veneriae mater filiae suae dulcissimae quae vixit annos XXI dies XXV et Panthagathus coniugi karissimae et sibi et suis posterisque eorum","mater"
"EDCS-18800075","mater","mat(er|ri|rum|re)","Carianae Luci libertae matri Carianae Spuri filiae Secundae sorori Caio Boviano Cai filio Clustumina Proculo Secundo Hyblaeo divi Augusti a manu","mater"
"EDCS-12300359","mater","mat(er|ri|rum|re)","Imperator Caesar Publius Licinius Valeria nus Pius  Felix Augustus pontifex maximus tribunicia potestate II consul II et Imperator Caesar Publius Licinius Egnatius Gallienus Pius Felix Augustus pontifex maximus tribunicia potestate II consul nomina militum qui  ante diem VI Idus Ianuarias Impperatoribus Valeriano Augusto II et Gallieno Augusto consulibus cohors I praetoria Valeriana Galliena Pia Vindex Publio Anneio Publi filio Probo Papiria Poetovione descriptum et recognitum  Imperator Caesar Publius Licinius Valerianus Pius Felix Augustus pontifex maximus tribunicia potestate II consul II et Imperator Caesar Publius Licinius Egnatius Gallienus Pius Felix Augustus pontifex maximus tribunicia potestate II consul nomina militum qui militaverunt in cohorti bus praetoriis Valerianis Gallienis decem I II III IIII V VI VII VIII VIIII X Piis Vindicibus qui pie et fortiter militia functi sunt ius tribuimus conubii dumtaxat cum sin gulis et primis uxoribus ut etiamsi pe regrini iuris feminas i lt n=M gt  matrimonio su o iunxerint proinde liberos tollant ac si ex duobus civibus Romanis natos ante diem   Idus Ianuarias Impperatoribus Valeriano Augusto II et Gallieno Augusto consulibus cohors I praetoria Valeriana Galliena Pia Vindex Publio Anneio Publi filio Probo Papiria Poeto lt v=B gt ione descriptum et recognitum ex tabula aerea quae fixa est Romae i lt n=M gt  muro post templum divi Augusti ad Minervam  Marci Aureli Quintiani Luci Aureli Simplici Publi Appei Marcellini Cai Caeli Germanicini Publi Aeli Bassani Marci Aureli Magrini  Publi Bellici Vicenti","matrimonium"
"EDCS-14900296","mater","mat(er|ri|rum|re)","Dis Manibus sacrum   Nunnius Secundinus Marci filius Quirina Luciolus vixit annis LXXXVIIII uxor et filii posuerunt hic situs est  Dis Manibus sacrum Sperontia Saturnina vixit annis LXXVI filii matri dulcissimae posuerunt hic sita est","mater"
"EDCS-23601026","mater","mat(er|ri|rum|re)","Cornelia Clara Quinti filia Anucla vixit annos XXXII hic sita est Cambia Cai filia Cambi lla matri posuit","mater"
"EDCS-23200564","mater","mat(er|ri|rum|re)","Dis Manibus Fortuni ae For tunataes  matri pi entissi mae Vitalis filius","mater"
"EDCS-01500174","mater","mat(er|ri|rum|re)","Probatae filiae dulcissimae quae vixit an nos   menses VIII dies XXII pater  us et mater Ur sina ponendum curaverunt","mater"
"EDCS-05503001","mater","mat(er|ri|rum|re)","Corneliae Cai filiae Flaccellae Quintus Iunius Pupillus matri","mater"
"EDCS-17500189","mater","mat(er|ri|rum|re)","Dis Manibus Luci Surdini Sa turnini liburna Ar mata natione Afer vixit annos XXXX militavit annos XVIIII Clodia Secunda mater filio bene merenti fecit","mater"
"EDCS-47200372","mater","mat(er|ri|rum|re)","Dis Manibus sacrum Lucio Plotio Noniano patri vixit annos LX et Antoni ae Capitoli nae matri","mater"
"EDCS-20401816","pater","pat(er|ri|rum|re)","Imperator Caesar divi Antonini Pii filius divi Veri Parthici maximi frater divi Hadriani nepos divi Traiani Parthici pronepos divi Nervae abnepos Marcus Aurelius Antoninus Pius Augustus Germanicus pontifex maximus tribunicia potestate XXVIII imperator VI consul III pater patriae proconsul restituit","patria"
"EDCS-08200895","pater","pat(er|ri|rum|re)","Dis Manibus Numerius Terraeus Dyrra chinus vixit annos XXIII hic situs Numerius Terraeus Dyrrachi nus pater filius merenti posuit","pater"
"EDCS-25800016","pater","pat(er|ri|rum|re)","Imperatori Caesari Marco Au relio Severo Ale xandro Pio Feliici Augusto pontifici maximo tribunicia potestate consuli patri patriae divi Severi Pii nepoti divi Antoni ni Magni Pii Fe licis filio res publica coloniae Thamugadis VIII","pater"
"EDCS-12100831","pater","pat(er|ri|rum|re)","Imperator Caesar divi Hadriani filius divi Traiani Parthici nepos divi Nervae pronepos Titus Aelius Hadrianus Antoninus Augustus Pius pontifex maximus tribunicia potestate XXI  imperator II consul IV pater patriae equitibus et peditibus qui militaverunt in alis V quae appellantur   et cohortibus XI   et sunt in Mauretania Tingitana sub Aeronio Montano procuratore quinis et vicenis   et conubium cum uxoribus quas tunc habuissent cum est civitas iis data aut cum iis quas postea duxissent dumtaxat singulis ante diem   Musa et Iuvenale consulibus alae    sagittariorum cui praeest   Marci Servili Getae Luci Pulli Chresimi Marci Sentili Iasi Tiberi Iuli Felicis Cai Belli Urbani Cai Pomponi Statiani Publi Ocili Prisci","pater"
"EDCS-11001739","pater","pat(er|ri|rum|re)","Imperatori Caesari Marco Aurelio Se vero Alexandro Pio Felici Augusto pontifici ma ximo tribunicia potestate consuli patri patriae proconsuli cohors I  Treverorum Severi ana Alexandriana equitata devota numini eius murum a solo fecit Maximo et Aeliano consulibus","patria"
"EDCS-20900001","pater","pat(er|ri|rum|re)","  dei Invicti Solis Elagabali pontifex maximus tribunicia potestate V consul IIII pater patriae et Marcus Aurelius Alexander nobilissimus Caesar imperii et sacerdotis consul nomina militum qui militaverunt in cohortibus urbanis  Antoninianis quattuor X XI XII XIIII  et Imperatoris Caesaris Marci Aureli Antonini Pii Felicis Augusti filius divi Antonini Magni Pii nepos divi Severi Pii pronepos Marcus Aurelius Alexander nobilissimus Caesar imperii et sacerdotis consul nomina militum qui militaverunt in cohor tibus urbanis  Antoninianis","patria"
"EDCS-24501103","pater","pat(er|ri|rum|re)","ritano patri Efa   o Gallicus Galloni   filius   aeternam   domum fecerunt","pater"
"EDCS-16201823","pater","pat(er|ri|rum|re)","Auspiciis Imperatoris Titi Caesaris divi Vespasiani filius Vespasiani Augusti pontificis maximi tribunicia potestate IX imperatoris XV consulis VIII censoris patris patriae per Marcum Ulpium Traianum consulem legatum Augusti legionis X Fretensis bello Iudaico et provinciae Syriae proconsulem Asiae et Hispanicae Baeticae XVvirum sacris faciundis sodalem Flavialem triumphalibus ornamentis ex senatus consulto cum amplius in eo crevit aqua nymphaeum dedicatum est","patria"
"EDCS-34801087","pater","pat(er|ri|rum|re)","Imperator Caesar divi Nervae filius Nerva Traianus Augustus Germanicus Dacicus pontifex maximus tribunicia potestate XI imperator VI consul V pater patriae equitibus et peditibus   et sunt in Moesia inferiore sub Lucio Fabio Iusto   quorum nomina subscripta sunt ipsis liberis posterisque eorum civitatem dedit et conub ium cum uxoribus quas tunc habuissent cum est civitas iis da ta aut si qui caelibes essent cum iis quas postea duxissent dumta xat singuli singulas ante diem VIII Kalendas Decembres Caio Iulio Longino Caio Valerio Paullino consulibus alae I Flaviae Gaetulorum cui praeest Quintus Naevius   gregali Caio Annio   et Saturnin  et Astico filio eius et Norbano filio eius descriptum et recognitum ex tabula aenea quae fixa est Romae  Tiberi Iuli Urbani  Quinti Pompei Homeri  Publi Pulli   Publi Cauli   Publi Atini Amerimni  Quinti Apidi Thalli  Cai Vettieni Modesti ","patria"
"EDCS-14501024","pater","pat(er|ri|rum|re)","Imperatori Caesari Lucio Septimio Severo Pio Pertinaci Augusto Arabico Adiabenico Parthico maximo Britannico maximo pontifici maximo tribunicia potestate III imperatori VII consuli II patri patriae proconsuli et Imperatori Caesari Marco Aurelio Antonino Pio Invicto Augusto Parthico maximo Britannico maximo Germanico maximo pontifici maximo tribunicia potestate XVI imperatori III consuli IIII patri patriae proconsuli fortis simo ac Felicissimo principi domino indulgentissimo milia passuum XI","pater"
"EDCS-28700978","frater","frat(er|ri|rum|re)"," Visi C I et fratri Rustico  os Tertio ","frater"
"EDCS-17201255","frater","frat(er|ri|rum|re)","Vivo Amphio sibi et Zetho fratri suo et vivo Alexandro et vivae Onesimae suis","frater"
"EDCS-27900078","frater","frat(er|ri|rum|re)","Dis Manibus Tito Flavio Vero defuncto annorum XXIII Rufus frater pius  posuit ","frater"
"EDCS-11701257","frater","frat(er|ri|rum|re)","Publius Plotius Publi filius Galeria Reburr us Interamn icus ex castello Cal laeco annorum XXI hic situs est fraternae pietatis opu s sedemque videtis aeternam quae Plotio  a morte fuit cum hoc fratris Vegeti dicavit cura sep ulcrum et pietate sua iustum persolvit amorem","frater"
"EDCS-18200411","frater","frat(er|ri|rum|re)","quod Titus Quinctius Crispinus Va lerianus magister fratrum Arva lium ad fratres Arvales rettulit Sullam Felicem flaminem   qui valetudine impeditus esset ad esse non posse ad sacra facien da d lt e=I gt ae Diae XVI XIIII XIII Kalendas Iunias in eius locum Marcus Valerius Messalli nus  suffectus est   adfuerunt Titus Quinctius Crispinus Valerianus magister Drusus Caesar Tiberi filius   ani  Marcus Valerius Messal lt l=I gt inus     Marcus Caecilius Cornutus Paullus Fabius Persi cus  Sextus Appuleius    Mamerco Aemilio Scauro Cnaeo Tremelio consulibus III Kalendas Iunias in regia  quod Titus Quinctius Crispinus Valerianus magister fratrum Arvalium ad fratres Arvales ret tulit in locum Sullae Felicis  demortui alium  a fratribus Arval ibus ad sacra deae Diae vocari de lt b=R gt ere solito more  Caium Pomponium  lt G=C gt raecinum fratrem Arvalem cooptarunt ad fuerunt Titus Quinctius Crispi nus Valerianus magister","frater"
"EDCS-12201235","frater","frat(er|ri|rum|re)","Dis Manibus Iulia Margaris fecit Sexto Iulio Agamedi coniugi bene merenti item Marco Ulpio Titiano fratri carissimo","frater"
"EDCS-28801233","frater","frat(er|ri|rum|re)","Amoenae Ulpi Histri servae Ursula mater Amoenus frater Pyladio conser v lt u=O gt s eius bene merenti posuerunt","frater"
"EDCS-20402035","frater","frat(er|ri|rum|re)","Dis Manibus Auguri no Victori nus et Ius tus fratri bene merenti posuerunt","frater"
"EDCS-30200746","frater","frat(er|ri|rum|re)","Dei Zbelsurdi SIL  Catulus Munatia nus G pro salu te parentum et fratrum","frater"
"EDCS-48600008","frater","frat(er|ri|rum|re)","Publio Septimio Severo Getae Caesari Imperatoris Caesaris Luci Septimi Severi Pii Pertina cis Augusti Arabici Adiabenici Parthici maximi filio Imperatoris Caesaris Marci Aureli Antonini Augusti fratri civitas Aurelia Thugga decreto decurionum pecunia publica","frater"
"EDCS-08601179","soror","soror","Dis Manibus Marcus Messalinus Aliquas vixit annos XXX menses VI dies V sorores piissimae fecerunt","soror"
"EDCS-14803878","soror","soror","Dis Manibus sacrum Faustina quae vixit annis XV Magri us Demetrius coniugi cum qu lt a=EM gt  vixit annum menses IIII Ampliatus frater sorori bene meren ti fecerunt hunc memoriae titulum","soror"
"EDCS-31400887","soror","soror"," ca   sorori infeli cissimae ponendum curavit","soror"
"EDCS-19300878","soror","soror","Sextus Allidius Symphorus fecit sibi et Sexto Allidio Hymenaeo filio et Allidiae Atticil lae sorori et Al lidiae Hymnidi uxori","soror"
"EDCS-12800636","soror","soror","Mimisiae Cai libertae Tertullae Caius Mimisius Cai filius Rufus sorori","soror"
"EDCS-12201400","soror","soror","Dis Manibus Iuliae Valeriae sorori qui vixit annos XIX menses III dies   Lucius Valerius Luci filius Iulianus vi lt v=B gt us fecit et sibi et matri carissimae et libertis libertabus que eorum","soror"
"EDCS-46600040","soror","soror","Titus Buzetius Diti filius Tura Ti   filia Tito Buzetia  mtena Gelli filia  testamento fieri iussit  tus Buzetius Titi libertus patrono arbitratu Titonis Buzetiae sororis et Sextionis Buzetia ae sororis","soror"
"EDCS-23500425","soror","soror","vixit annis   milita vit annis X soror cum coheredibus posuerunt","soror"
"EDCS-14800376","soror","soror","Dis Manibus sacrum Aponio Lanponti vixit annos XXXXVI Primigenia soror et Apelles filius bene merenti posuerunt","soror"
"EDCS-07000498","soror","soror","Grata annicula Castus trimus frater et soror","soror"
"EDCS-09701365","noverca","noverca","Ne dubitare precor titulo meo fata dolere antequa lt m=N gt  addiscis en ego quae fuerim simplex suavis amans dulcis delicia iocosa et tamen in thalamis uno contenta marito limina coniugii dilexi quae mea semper aequore Tyrrheno comes adfui saepe marito illa ego quae natos triplices inixa paravi ipsa hos institui concordes discere mores ut similes vitae maneant probitate et amor lt e=I gt  funereos casus matris suae qui modo merent dura quod adscripsit fatorum vera potestas nescio quis poterit superis tam laeta videre quam modo lascivo quae gessi tradita lusu saevos Aeacidas saltavi carmen amavi ob novercales vultus fui cognita digne vos superi meos casus mortal lt e=I gt sque precor discite si semper vivit mea fama per annos","novercalis"
"EDCS-08401430","noverca","noverca","Dis Manibus Luci Hostili Teretina Silvani annorum XXIIII mensium II dierum XV mater filio piissimo misera et in luctu aeternali benefici o novercae","noverca"
"EDCS-05600359","noverca","noverca","Iuliae Severae Audaleae Gai  Fabi Cai filii Gaius  Fabius Tuscus optimo filio et piae novercae","noverca"
"EDCS-81200071","privignus","privign","  Oufentina Rufus sibi et   Dionysiae uxori suae     filio Oufentina Nigro privigno   ex testamento","privignus"
"EDCS-12401606","privignus","privign"," Caio Mettio Cai filio Stellatina Rufo Foroniano Caelia Publi filia Maxima mater filio suo et viro et privigno viva fecit IIII Kalendas Septembres","privignus"
"EDCS-73000015","privignus","privign","Dis Manibus Aelianius Martini anus miles legionis II Parthicae |centuria pili primi natione Italus na tus Foro Cemeli vixit annos XXXX militavit annos XXI Masv ania Fortunata coni unx Aelianius Mar cellianus privignus  ","privignus"
"EDCS-09300890","privignus","privign","Apriles  Drusi Germanici Caesaris patris Augusti privigni   Septembres  Cai Caesaris divi Augusti filii   Iulias  Luci Caesaris divi Augusti filii","privignum"
"EDCS-20800678","privignus","privign","Dis Manibus sacrum Lucius Arruntius Satur ninus beneficiarius praefecti legionis III Augustae vixit annos XXV Tonneius Victor privigno merenti fecit","privignus"
"EDCS-08800136","privignus","privign"," mater     privigno    IL","privignus"
"EDCS-09600320","privignus","privign","Dis Manibus Claudiae Hagni filiae Gazzae privignae suavissi mae in honorem memo riae Gazzae matris eius Claudius Pyrrichus vitricus consecravit","privignus"
"EDCS-05100284","privignus","privign","Quinto Atilio Quinti filio Oufentina Crispo VIviro Munatia Lecta piissimo privigno IIIIviro iure dicundo","privignus"
"EDCS-44800203","privignus","privign","ilia   privigna  n","privignus"
"EDCS-10201118","privignus","privign","Quinto Gavio Crescenti qui vixit annos XXI dies XI Caius Pompeius Verus privigno pientissimo fecit dis Manibus Quintus Gavius Onesimus Elpidi coniugi et Mar co fratri bene meren tibus et libertis liber tabusque posterisque eorum hoc monumentum heredem non sequetur huic monumento dolus malus abesto Quinto Gavio Aniceto qui vixit annos XI menses IIII dies XV Licinia Crescentina mater infelicissima fecit","privignus"
"EDCS-08200023","amita","amita","Caio Valerio Cai filio Galeria Sereno Valeria Atta amita","amita"
"EDCS-15900529","amita","amita","Dis Manibus Iulia Sere na vixit annos LXXI Gaius  Bellicius Quintian us amitae piisimae fecit","amita"
"EDCS-14805597","amita","amita","patri Caesiae Quinti filiae matri   Maeciae Titi filiae aviae   Sexti filiae amitae ","amita"
"EDCS-18900269","amita","amita","Dis Manibus Aureli Victorino evo lt c=K gt ato ex  lt c=K gt astris praetoriis avunculo qui  lt v=B gt ixit annos LXXX menses VII et dies V et Aureliae Valentinae coniu lt g=C gt i eius amitae meae quae vixit annos LXXVII menses VIIII et dies XXI ex  lt t=I gt esta men lt t=I gt o heres V lt a=X gt lentin lt u=I gt s una cu lt m=N gt  In lt g=C gt enu lt o=Q gt  bene merenti fecit","amita"
"EDCS-04000890","amita","amita","Marco Cornelio Frontoni Gabiniano amitae  filio","amita"
"EDCS-33700001","amita","amita","Lucio Pompeio Cai filio Campano avo a patre  Catiae Secundinae aviae  Pompeiae Maximae sorori a patre    Pompeio Campano fratri    IAE   Decimo Valerio Grato  Caio Sentio Agricolae avunculo  Pompeiae Luci filiae Secundinae amitae  Caio Pompeio Iusto fratri et parentibus  Voluntiliae Cai filiae Censae aviae a matre  Caio Sentio Iusto avo a matre  Tito Cannutio Attico Perpesso  Lucio Pompeio Campano Campani et Sentiae filio  Lucius Pompeius Campanus vivus fecit","amita"
"EDCS-09000964","amita","amita","Corneliae Publi filiae Annocae Marcus Cornelius Priscinus amitae","amita"
"EDCS-23102763","amita","amita","es fecit sibi   amitae suae  e vernae suae  XX et suis libertis libertabusque posterisque eorum si quis autem hoc sepulcro corpus alienum ponere voluerit aerario populi romani inferet HS X milia nummum","amita"
"EDCS-08400216","amita","amita","Dis Manibus sacrum Marco Stallio Quinti filio Arnensi Nepoti vixit annos XXV menses X dies XV Quintus Stalli us Clarus pa ter et Auctus et Naius fratres et Thisbe amita et Hosidia For tunata parentes posuerunt","amita"
"EDCS-09000964","amita","amita","Corneliae Publi filiae Annocae Marcus Cornelius Priscinus amitae","amita"
"EDCS-14500293","filia","filia","Tertius Iuni vivus fecit sibi et Seneciae Covnerti filiae uxori optimae et   Iantullo fratri et Secundae sorori hoc monumentum heredem non sequetur","filia"
"EDCS-32500167","filia","filia","Matugenta Aprilis filia annorum IIII vernacu la Titi Flavi Bitu rigis hic sita est pater filiae posuit","filia"
"EDCS-10801146","filia","filia","Cas s V V mon lt u=I gt mentum   Donna Dannai filia ","filia"
"EDCS-21300152","filia","filia","Dis Manibus sacrum Caecilius Nigrinus Caeciliae Ca stulae filiae merenti qua lt e=I gt  vixit annos XI","filia"
"EDCS-09300836","filia","filia","Dis Manibus Tyche filia matri bene merenti fecit","filia"
"EDCS-28300024","filia","filia","Primitivae filiae defunctae annorum XXXIII parentes Lartius et Emogenia miserrimae filiae posuerunt","filia"
"EDCS-13700087","filia","filia","cius Luci filius Quiri na Pu sio vixit annos   hic situs est  M  filia Quirina Mo nna vixit annos L hic sita est","filia"
"EDCS-09202319","filia","filia","Dis Manibus Primulae Certi filiae et Certi Ventidi patris Capriliae Cai filiae matris Cai Certi filii fratris Luci Sentii Optati viri Nice liberta et Lucius Acutius Ventidius filius eius testamento fieri iussit","filia"
"EDCS-14803669","filia","filia","Viva fecit Suellia Cai filia Consanica sacerdos Cerialis Deia Libera hoc monumentum heredem non sequetur","filia"
"EDCS-08700106","filia","filia","Aniciae Sexti filiae Postumae Etrili Afri colonia Augusta Gemella decreto decurionum","filia"
"EDCS-18600181","filius","fili(us|i|o|um)","Dis Manibus Isidoro qui et Hermiae lintiario Ostoria Acte viro bene merenti fecit et sibi et Tito Calestrio Hermino filio et Marco Ostorio Lamyro tutori suo et libertis libertabus posterisque eorum utriusque sexus","filius"
"EDCS-14400645","filius","fili(us|i|o|um)","Imperator Caesar divi Traiani Parthici filius divi Nervae nepos Traianus Hadrianus Augustus pontifex maximus tribunicia potestate XVI consul III pater patriae proconsul III","filius"
"EDCS-10201038","filius","fili(us|i|o|um)","Dis Manibus Caius F lt i=Y gt rmius Metras et Aelia Chryso tyche Caio F lt i=Y gt rmio Metrae filio dulcissimo fecit","filius"
"EDCS-46400267","filius","fili(us|i|o|um)","Imperator Caesar divi Traiani Parthici filius divi Nervae nepos Traianus Hadrianus Augustus pontifex maximus tribunicia potestate XVII consul III pater patriae iis qui militaverunt in classe praetoria Misenensi  quae est sub Calpurnio Seneca   stipendiis emeritis dimissis honesta missione quorum nomina subscripta sunt ipsis liberis posterisque eorum civitatem dedit et conubium cum uxoribus quas tunc habuissent  Imperator Caesar divi Traiani Parthici filius divi Nervae nepos Traianus Hadrianus Augustus pontifex maximus tribunicia potestate XVII consul III pater patriae iis qui militaverunt in classe praetoria Misenensi  quae est sub Calpurnio Seneca   stipendiis emeritis dimissis honesta missione quorum nomina subscripta sunt ipsis liberis posterisque eorum civitatem dedit et conubium cum uxoribus quas tunc habuissent cum est civitas iis data aut si qui caelibes essent cum iis quas postea duxissent dumtaxat singuli singulas ante diem V  Quinto Flavio Tertullo Quinto Iunio Rustico consulibus","filius"
"EDCS-21800380","filius","fili(us|i|o|um)","V  Imperator Caesar divi Nervae filius Nerva Traianus Augustus Germanicus pontifex maximus tribunicia potestate VI imperator II consul IIII pater patriae inchoatam a divo Nerva patre suo peragendam curavit","filius"
"EDCS-45900138","filius","fili(us|i|o|um)","Lucius Pomponius Publi filius annos vixit XXC","filius"
"EDCS-14900270","filius","fili(us|i|o|um)","Senatus consultum de nundinis saltus Beguensis in territorio Casensi descriptum et recognitum ex libro sen tentiarum in senatu dictarum Kani Iuni Nigri Cai Pompo ni Camerini consulum in quo scripta erant Africani iura et id quod infra scriptum est Idibus Octobribus in comitio RVM in curia Iulia scribundo adfuerunt Quintus Gargilius Quinti filius Quirina Antiquus Tiberius Claudius Tiberi filius Palatina Quartinus Caius Oppius Cai filius Velina Severus Caius Herennius Cai filius Palatina Caecilianus Marcus Iulius Marci filius Quirina Clarus Publius Cassius Publi filius Claudia Dexter quaestor Publius Nonius Marci filius Oufentina Mac rinus quaestor in senatu fuerunt CCL  senatus consultum per discessionem factum quod Publius Cassius Secundus Publius Delphius Peregrinus Alfius Alen nius Maximus Curtius Valerianus Proculus Marcus Nonius Muci anus conssules verba fecerunt desiderio amicorum Lucili Africa ni clarissimi viri qui petunt ut ei permittatur in provincia Africa regione Beguensi territorio Musulamiorum ad Casas nundinas IIII Nonas Novembres et XII Kalendas Decembres ex eo omnibus mensibus IIII Nonas et XII Kalendas sui cuiusque mensis instituere habere quid fieri placeret de ea re ita censuerunt permittendum Lucilio Africano clarissimo viro in provincia Africa regione Beguensi territorio Musulamiorum ad Casas nundinas IIII Nonas Novembres et XII Kalendas Decembres et ex eo om nibus mensibus IIII Nonas et XII Kalendas sui cuiusque mensis in stituere et habere eoque vicinis advenisque nundinandi dumtaxat causa coire convenire sine iniuria et in commodo cuiusquam liceat actum Idibus Octobribus Publio Cassio Secundo Marco Nonio Muciano eodem exemplo de eadem re duae tabellae signatae sunt signatores Titi Flavi Comini scribae Cai Iuli Fortunati scribae Marci Caesi Helvi Euhelpisti Quinti Metili Onesimi Cai Iuli Periblepti Luci Verati Philerotis Titi Flavi Crescentis  Senatus consultum de nundinis saltus Beguensis       co  in comitio RVM in curia Iulia scribundo adfuerunt Quintus Gargi lius Quinti filius Quirina Antiquus Tiberius Claudius Tiberi filius Palatina Quartinus Caius Oppius Cai filius Velina Severus Caius Herennius Cai filius Palatina Caecilianus Marcus Iulius Marci filius Quirina Clarus Publius Cassius Publi filius Claudia Dexter quaestor Publius Nonius Marci filius Oufentina Macri nus quaestor in senatu fuerunt CCL  senatus consultum per discessionem factum quod Publius Cassius Se cundus Publius Delphius Peregrinus Alfius Alennius Maxi mus Curtius Valerianus Proculus Marcus Nonius Mucianus conssules verba fecerunt de desiderio amicorum Lucili Afri cani clarissimi viri qui petunt ut ei permittatur in provincia Africa regione Beguensi territorio Musulamiorum ad Casas nundinas IIII Nonas Novembres et XII Kalendas Decembres ex eo omnibus IIII Nonas et XII Kalendas sui cuiusque mensis instituere habere quid fieri placeret de ea re ita censuerunt permittendum Lu cilio Africano clarissimo viro in provincia Africa regione Beguensi territorio Musulamiorum at  Casas nundinas IIII Nonas Novembres et XII Kalendas Decembres et ex eo omnibus mensibus IIII Nonas et XII Kalendas sui cuiusque mensis instituere et habere eoque vicinis advenisque nundinandi dumtaxat causa coire conve nire sine iniuria et incommodo cuiusquam liceat actum Idibus Octobribus Publio Cassio Secundo Marco Nonio Muciano eodem exemplo de eadem re duae tabellae signatae sunt signatores Titi Flavi Comini scribae Cai Iuli Fortunati scribae Marci Caesi Helvi Euhelpisti Quinti Metili Onesimi Cai Iuli Peri blepti Luci Verati Philerotis Titi Flavi Crescentis","filius"
"EDCS-78800125","filius","fili(us|i|o|um)","Imperatori Caesari divi Antonini Pii filio divi Hadriani nepoti divi Traiani Parthici pronepoti divi Nervae abnepoti Lucio Aurelio Vero Augusto    Publio Iuventio Celso consulibus Marco Caecilio Aemiliano Quinto Iulio Marcelliano IIviris","filius"
"EDCS-23801794","filius","fili(us|i|o|um)","Dis Manibus sacrum Quintus Iulius Cai filius Quirina Iulianus vixit annos XXXVI hic situs est","filius"
"EDCS-10200453","filius","fili(us|i|o|um)","Dis Manibus Titi Flavi Urbici vixit annis IIII diebus XVI Titus Flavius Augusti libertus Chrysogonus et Flavia Primitiva filio suo et Marcus Antonius Hermes fecerunt sibi et suis libertis libertabusque posterisque eorum hoc monumentum exterum heredem non sequetur","filius"
