"ID","Lemma (RegEx)","Regulärer Ausdruck","Text","Lemma (Latincy)"
"EDCS-34700169","maritus","marit(us|i|o|um)","Dis Manibus Tiberio Claudio Tiberi filio Myrtilio vixit annos LXXXVI sine cuiusque iniuria Asinia Nomas marito optimo","maritus"
"EDCS-10300306","maritus","marit(us|i|o|um)","Dis Manibus sacrum  us  VII   Dis Manibus sacrum Iulia Rogatina vixit annis XXV hic sita est parentes filiae cari ssimae posuerunt  Dis Manibus sacrum Iulia Inventa vixit annis XXX hic sita est parentes fil iae carissimae posuerunt  Dis Manibus sacrum Lucius Magnius Satur homo laboriosus non dignus loco pe regre defunctus in via Hadrumetina vixit annos LV Iulia Quinta coniunx  carissima marito suo posuit  hic situs est","maritus"
"EDCS-15600070","maritus","marit(us|i|o|um)","Dis Manibus Calpurnio Felicia no qui vixit annos   menses tres dies XVII fecit Calpurnia Thal lusa marito bene meren ti","maritus"
"EDCS-05401366","maritus","marit(us|i|o|um)","Marco Mutilio  Marci filio Processo     marito et sibi Anusia Phoebas viva fecit","maritus"
"EDCS-52602586","maritus","marit(us|i|o|um)","IM  marito suo     annis XXII et    ce et Iunio     libertabusque posterisque eorum","maritus"
"EDCS-05501951","maritus","marit(us|i|o|um)","Dis Manibus sacrum Lucius Aurelius  aris  veteranus legionis VII Geminae Piae Felicis Aurelia Messia marito posuit decreto decurionum","maritus"
"EDCS-20800737","maritus","marit(us|i|o|um)","Dis Manibus sacrum Titus Flavius Titi filius Ul pia Herc ulanus R lt a=E gt tiaria |centurio legionis III Augustae Piae Vindicis Antoni nianae vix it annis XL C occeia Digna marito merenti fecit","maritus"
"EDCS-14800397","maritus","marit(us|i|o|um)","Apphis Leonidu filia sibi et suis posterisque eorum   lt I=F gt acet Urbice pater S que fecit cum marito","maritus"
"EDCS-47400215","maritus","marit(us|i|o|um)","Dis Manibus sacrum Avia  pius vixit annos LX uxor karissima marito posuit","maritus"
"EDCS-11800284","marita","marita","Dis Manibus Saturninus Biti vixit annis XXXX et Curi tthie filius et Valeria et Sabi na filia lt e=S gt  eius Ziles marita suo marito bene mer enti titulum posuit","maritum"
"EDCS-23701966","marita","marita","Caeci liae Quinti filiae Maiae maritae merenti vixit annos XXXIX hic sita est ossa tibi bene quiescant  Quintus Aemi lius Marci filius Quirina Iuciun dus vixit annos XVI hic situs est ossa tibi bene quiescant","maritus"
"EDCS-23200141","marita","marita"," donatus  lt v=N gt ovi doloris   hoc loco Iulia Syra quae et Thessa lt l=I gt ia rarissima marita quae vixit annos XXII menses VI dies VII Aelius Donatus maritus fecit dedicavitque anno provinciae CLXXXXV ","maritus"
"EDCS-14200827","marita","marita","Bonae memoriae Sosiai  Probae coniugi dulc issimae in cas titate omnique ob sequio maritali deditae inco lt m=N gt par abili quae vixit annos XXXIV menses IIII dies XXV in coniu gio vixit annos XV menses IV QQuinti Sosii Eusebius et Euani cetus filii bene merenti fecerunt","maritalis"
"EDCS-13303131","marita","marita","Dis Manibus et memoriae aeternae Danfiolae Danfeiiani filiae civi Veliocassini ae quae vixit annis XVII mense I diebus XII maritata anno I mensibus II die I et Vin centio sive Danfio fratri eiusdem Dan fiolae qui vixit annis III mensibus VIII diebus II Danfeiia nus cum Proculeiia coniugi parentes infelicissimi vivi sibi defunctis IIII hoc mon lt u=I gt mentum sub ascia dedicaverunt","marito"
"EDCS-26200786","marita","marita","Dis Manibus sacrum Ulpio Castro filio optimo Caius Cal purnius Felix Ulpiae Syrillae maritae cast lt ae=O gt  M vixit annos XVIII","maritus"
"EDCS-22900385","marita","marita","Dis Manibus Lucio Cominio Luci filio Trophimo vixit annis XX mensibus X diebus XI et Cominiae maritae Sextus Aebutius Labeo discenti et sorori eius bene merenti","maritus"
"EDCS-23200117","marita","marita","Dis Manibus sacrum Quinto Gargilio Campano coniugi dulcissimo mausoleum opere quadratario secundum verba testamenti eius super HS XVImilia nummum quae dependi mandaverat additis de suo HS VIIImilia nummum Gargilia Pacata marita a solo omnibus i lt m=N gt pendiis suis extruxit itque infra tem pora testamento praefinita dedicavit   provinciae CLXXXXIIII VIIII Idus Augustas","maritum"
"EDCS-27800974","marita","marita","Antistius Zo ticus vixit annos XXXVI hic situs est An tistia Antonina marita ei us et Stelea Atilia Fortunata ma ter heredes primi","maritus"
"EDCS-82100022","marita","marita","Dis O Manibus Pompe lt i=Y gt us Atticus SPSI maritae suae BOBO maritae fecit sit tibi terra levis","maritus"
"EDCS-02900171","coniux","coniu(n?)(x|gi)","Mettia Marci liberta Amab ilis Quintus Pop paedius Quinti libertus Amenus coniugi suae merenti et sibi fecit","coniunx"
"EDCS-12100976","coniux","coniu(n?)(x|gi)","Publio Graecinio Narcisso Marcia Iucunda coniugi suo et sibi fecit","coniunx"
"EDCS-25001721","coniux","coniu(n?)(x|gi)","Dis Manibus sacrum Feliculae bene me renti coniugi pi ae vixit annos XXXVII menses IIII fecit Aelius Saturus hic sita est","coniugs"
"EDCS-12101543","coniux","coniu(n?)(x|gi)","Dis Manibus Ianuarius Auggustorum libertus Metiliae Fabianae coniugi inco lt m=N gt parabili quae vixit annis XXXV mensibus X bene merenti fecit","coniunx"
"EDCS-08400143","coniux","coniu(n?)(x|gi)","Dis Manibus  iae Benustae  coniugi quae vixit annos LV menses VIIII die s","coniunx"
"EDCS-11900567","coniux","coniu(n?)(x|gi)","Dis Manibus  Marco Antistio Melitoni filio dulcissimo qui vixit anno I mensibus X diebus XIII Marcus Antistius Epictetus fecit sibi et Arriae Melitine uxori sanctissimae et liberis suis et Iuniae Epictesi filiae suae naturali «sarcofagum unum» «in pavimento et Flaviae» Erotidi coniugi sanctissimae feminae et libertis libertabusque posterisque eorum","coniunx"
"EDCS-09600782","coniux","coniu(n?)(x|gi)","Dis Manibus Aulus Cocceius Onesimus fecit Cocceiae Mosxidi coniugi bene merenti","coniunx"
"EDCS-24000149","coniux","coniu(n?)(x|gi)","Dis Manibus sacrum Silvani Caesaris nostri servi vernae dispensatoris scaenicorum vixit annos XXXIIII poserunt Quintilia Procula coniunx eius et Felix Augusti libertus frater","coniunx"
"EDCS-12401499","coniux","coniu(n?)(x|gi)","Dis Manibus sacrum Quinto Tituleio Marcellino coniugi qui vixit aetate annis XLV et mecum an nis XVIII Munatia Feli citas coniugi bene merenti fecit","coniunx"
"EDCS-05700698","coniux","coniu(n?)(x|gi)","Dis Manibus Blasteni fecit Caius Litorius Tro phimus coniugi bene merenti","coniunx"
"EDCS-20402288","concubina","concubina","Lucio Attio Luci liberto Dioni patrono Annaeae |mulieris libertae Statiae concubinae Lucius Attius Luci libertus Salvius Apollinaris testamento fieri iussit arbitratu Laeti et Attici liberti","concubina"
"EDCS-22500756","concubina","concubina","Titus Tillius Titi filius Palatina Sabinus |centurio cohortis XII urbanae II  Postumia Phyllis fratris uxor Caninia Musa concubina Sabini","concubina"
"EDCS-34700339","concubina","concubina","  Sertorius Luci libertus Aequalis vivus fecit sibi et suis corporibus VI Helvaciae |mulieris libertae Gratae concubinae Lucio Sertorio Primo liberto","concubina"
"EDCS-12201610","concubina","concubina","Dis Manibus Iustae concubinae","concubina"
"EDCS-85700902","concubina","concubina","  Quartio  scia uxor   vixit annis XII   concubina   Lucrio libertus   libert","concubina"
"EDCS-20401262","concubina","concubina","Vivit  Caio Tellutio Proto sibi et Ammiae Luci libertae Tuscae concubinae suae et Tellutiae Hilarae","concubina"
"EDCS-12401758","concubina","concubina","Marcus Appuleius Dialogus sevir Augustalis sibi et Marco Appuleio Fausto seviro Augustali patrono et Herenniae Quinti libertae Tertiae et Liciniae |mulieris libertae Methae concubinae suae et Antoniae Alchae et Lucio Licinio |mulieris liberto Telesino","concubina"
"EDCS-20402330","concubina","concubina","Titus Lucceius Titi libertus Auctus Victor sibi et suis Clodiae Cyparae concubinae et uxoribus concubinis libertis libertabus servis ancillis in fronte pedes XII in agro pedes XIIII","concubina"
"EDCS-63400196","concubina","concubina","De munere publico libitinario  decesserit gratuita haec praestantur   intra fines coloniae  sublatum et at ustrinam per   sin autem praestare sibi  nt quanti praestantur tanti ei   pro operis  singulis in milia passuum singula dum ne ultra milia passuum  r pro ustore dare   HS IIII nummum aut si ultra volet   pro mercennario HS X nummum utro eorum mallet ut  mer fuerit decesserit prae stare   qui funus faciet curabitve pro singulis operis HS   dare debeto   manceps omnia quae ad   maius HS XX nummum pro ara   asses singulos pro operis singulis   dum ne ultra milia V HS LV nummum   pro operis singulis dum ne ul tra milia     sive suis sive mancipis     HS XXIV nummum pro chalc idico  a minus HS VIII nummum pro   nummum aut si ultra volet   curro  suo utetur usque ad   pro operis singulis in milia passuum HS XX nummum dare debeto  is lignis gremis sar mentis      tantundem praestare debeto   efferri volet tum   HS VIII nummum   quantum in ipsius   eius rei cura esto idem praestare debeto   efferendum curato et   si quis cadaver proiecerit tum is mancipi  sociove eius quotienscumque proiecerit in singula cadavera HS LX nummum damnas esto dare deque ea r lt e=VM gt  magistratus recipe ratorium iudicium e lege coloniae cogito operae quae ad eam rem praeparatae erunt ne intra turrem ubi hodie lucus est Libitinae habitent laventurve ab hora I noctis neve veniant in oppidum nisi mortui tollendi conlocandive aut supplici sumendi causa dum ita quis eorum veniat quotiens oppidum intrabit in oppidove erit ut pilleum coloratum in capite habeat et dum ne quis eorum maior annorum L minorve annorum XX sit n lt e=I gt ve valetudinarius n lt e=I gt ve luscus n lt e=I gt ve mancus n lt e=I gt ve clodus n lt e=I gt ve caecus n lt e=I gt ve stigmatibus inscriptus sit et ne pauciores manceps operas habeat quam XXXII qui supplicium de servo servave privatim sumere volet uti is qui sumi volet ita supplicium sumet si in crucem patibulo agere volet redemptor asseres vincula restes verberatoribus et verberatores praebere debeto et quisquis supplicium sumet pro operis singulis quae patibulum ferunt verberatoribusque item carnifice HS III dare debeto quotiens supplicium magistratus publice sumet ita imperato quotienscumque imperatum erit praestu esse sup plicium sumere cruces statuere clavos picem ceram candelas quaeque ad eas res opus erunt redemptor gratis praestare debeto item si unco extrahere iussus erit opera russata id cadaver ubi plura cadavera erunt cum tintinnabulo extrahere debebit quotiens  lt q=C gt uisquis ex is rebus qu lt as=I gt  hac lege utique praebere oportebit praeber lt i=E gt  volet denuntiato denuntiatumve cura to mancipi eius publici sociove eius eive ad quem ea res qua de agitur pertinet aut si is praesens non erit ad eum locum quem libitinae exsercendae gratia conductum constitutumve habebit quo die quoque loco quam que rei praeberi volet et   ita denuntiatum erit tum is manceps sociusve eius isve ad quem ea res qua de agitur pertinet ei qui primum denuntiaverit et deinceps reliquis ut quisque denuntiaverit nisi si funus decurionis funusve acerv lt u=O gt m denuntiatum erit cui prima curanda erint reliquorum autem fu nerum ordo servandus omnes res quae ex hac lege praestandae erunt mittere praebere quae praebendae   suspendiosum cum denuntiatum erit eadem hora dissolvendum tollendum curato item serv lt u=O gt m servamve si ante horam X diei denuntiatum erit eadem die tollendum curato si post X postera die ante horam II si per mancipem sociumve eius eumve ad quem ea res qua de agitur pertinet mora fuerit quominus operas aliasve res quas hac lege eum mittere utique praebere oportebit mittat praebeatve tum is qui funus faciet cu rabitve eas res praebendas sine dolo malo locato quot ita praebendum locaverit is   conduxerit ususque erit ob eam rem ei qui id publicum exsercebit neque dare neque praestare debeto quanto pluris locatum con ductumve fuerit manceps sociusve eius isve ad quem ea res qua de agitur pertinet ei alterum tantum   conduxerit praestare debeto damnasque esto dare deque ea re magistratus reciperatorium iu dicium e lege coloniae cogito quod publice iussu magistratus denuntiatum erit legeque cautum erit ut   debeat si ita factum non erit ei magistratus multam dicito HS   eius multae earumve multarum pigneris captio exactioque esto   et in aerarium coloniae per quaestoribus  inferendum curato  Si quis alius praeter manceps sociusve eius isve ad quem ea res qua de agitur pertinet eas res de quibus hac lege comprehensum est ante denuntiationem praebendas conduxerit is qui locaverit mancipi HS C nummum damnas esto dare item qui conduxerit eidem mancipi sociove eius eive ad quem ea res qua de agitur pertinet HS   nummum damnas esto dare deque is multis magistratus iudicia reciperatoria e lege coloniae cogito si controversia erit colonus qui sit aut incola   aut eorum cuius libertus libertave aut concubina eorumve cuius   pertineant quod ex hac lege petitur is qui funus faciet curabitve   re et omnibus iustis permitti magistratus   in ea causa esse quae hac lege excepta est duplum eum   dare solvere sa tisve facere iubeto eiusque multae pignus capere ei liceto manceps ne plures socios eos de quibus id negotium geritur habeat quam   curato si plures esse dicentur is qui aget si volet licet ei ad reciperatores aut iu dicem ire de hac re reciperatores iudexve detur   de quibus hac lege com prehensum est formulaque ab eo qui iure dicundo praeerit constitut   inter redem ptorem praedesve heredesve cuius eorum et colonum coloniae   qui de ea re hac lege ageret heredique eius alia HS X damnas dare esto mancipi sociove eius  lt s=E gt ive ad quem ea res qua de agitur pertinet haec gratuita praestantur   et cellam funeream sunt item lignaria quae ante hunc diem   qui libitinae exsercendae praeerat manceps hanc legem propositam habeto eo loco quem eius rei exsercendae gratia conductum constitutum habebit ut de plano recte legi possit si quid adversus hanc legem manceps sociusve eius isve ad quem ea res qua de agitur pertinet fecerit itave quid non fe cerit  ta ab eo capite comprehensa tum is in res singulas in aerarium coloniae multam inferre debeto HS C nummum earumque multarum magistratuum pigneris captio exactioque esto","concubina"
"EDCS-20402721","concubina","concubina","Viva fecit Salvia |mulieris liberta Iconio sibi et Publio Salvio Thelo conliberto Murriae Primae concubinae eius","concubina"
"EDCS-12600536","contubernalis","contubernal(|i|e)","Dis Manibus sacrum Marco Lollio Saturninae liberto Principi amico fidissimo qui vixit annis LVIII et Lolliae Saturninae libertae Urbanae contubernali eius et Lolliae Saturninae libertae Methes sorori eius Lollia |mulieris liberta Galatea parentibus caris simis fecit permissu Ur sionis contubernalis mei","contubernalis"
"EDCS-12201067","contubernalis","contubernal(|i|e)","Iuliae Aurae vixit annos XXXVIII Tiberius Claudius Augusti libertus Herma contubernali suae fecit","contubernalis"
"EDCS-13800334","contubernalis","contubernal(|i|e)","Phileros vixit annis XXV Musa filia eius vixit annis XI mensibus V Manlia Primigenia fecit contubernali suo et filiae suae et sibi","contubernalis"
"EDCS-04700125","contubernalis","contubernal(|i|e)","Vivus fecit Quintus Publicius Anthus sibi et Viriae   Macrinae contubernali et Viriae Sexti  libertae  Tertullae","contubernalis"
"EDCS-20402434","contubernalis","contubernal(|i|e)","Dis Manibus Caius Quintius |mulieris libertus   sibi et Marcellinae Quintiae contubernali in fronte pedes XIII in agro pedes XXX","contubernalis"
"EDCS-23900617","contubernalis","contubernal(|i|e)","Caio Annio Evaris to Annia Iucunda contubernali suo  lt f=E gt ecit","contubernalis"
"EDCS-19200186","contubernalis","contubernal(|i|e)","Dis Manibus Primigenius Luci nostri ab hospitiis Charidi contubernali bene merenti et suis","contubernalis"
"EDCS-09301678","contubernalis","contubernal(|i|e)","Marcus Coelius Marci libertus Onesimus sibi et Primigeniae contubernali libertae et Cerviae Fuscae matri tonsori","contubernalis"
"EDCS-12401693","contubernalis","contubernal(|i|e)","Tiberius Claudius Restitutus sibi et Claudiae Tertullae contubernali Claudio Felici filio et suis in fronte pedes XIV in agro pedes XIV","contubernalis"
"EDCS-09700052","contubernalis","contubernal(|i|e)","Dis Manibus Rufillae Moschus Sergiae Paulinae servus contubernali karissimae bene merenti fecit","contubernalis"
"EDCS-13802071","parens","paren(s|ti|te|tum)","aiori filio dulcissimo Salvius et  esia parentes fecerunt qui vixit annos VI mensem I dies   bene merenti","parens"
"EDCS-20401087","parens","paren(s|ti|te|tum)","Dis Manibus Staediae Syneru sae vixit mensibus X diebus XIX Quintus Staedius Chrysori as et Casinia Synerusa parentes","parens"
"EDCS-04200425","parens","paren(s|ti|te|tum)","Dis Manibus Sexto Fulcinio Sexti filio Velina Vero decurioni Parentino annorum XIIII dierum XXXVII huic ordo pientissi mus decreto suo funus publicum et res publica turis libras tres titulis publice ferri universi censuerunt huic et collegium fabrum turis mittendi habuit honorem qui parentes suos miseros senes in luctu reliquit parentes filio pientissimo et sibi vivi posuerunt","parens"
"EDCS-73700317","parens","paren(s|ti|te|tum)","Dis Manibus sacrum Caio Statio Bes sioni et Aero niae Severi nae coniugi eius Stati Veloci anus et Se verina filii parentibus posuerunt","parens"
"EDCS-13301106","parens","paren(s|ti|te|tum)","Dis Manibus Pelliae Atticillae et Caio Mario Pu denti parentibus dulcissimis fecit Maria Iusta","parens"
"EDCS-19700209","parens","paren(s|ti|te|tum)","Tiberio Claudio Liberali prafeecto fabrum equo publico filio optimo piissimo dulcissimo sodali desiderantissimo vixit annis XVI mensibus V diebus XXI parentes infelicissimi","parens"
"EDCS-12600497","parens","paren(s|ti|te|tum)","Dis Manibus sacrum Li lt v=B gt iae Sympho ridi filiae du lt l=I gt cissimae quae vixit annos XV menses VIIII dies XXVII parentes fecerunt","parens"
"EDCS-05700569","parens","paren(s|ti|te|tum)","Dis Manibus Anniano vixit annos II menses VI dies XVIII parentes fecerunt","parens"
"EDCS-23000471","parens","paren(s|ti|te|tum)","Dis Manibus hic Maxima iacet nunc Vi dia funeri acerbo rapta pat ri et matri raptamque s lt o=E gt rori duo et quaternos vitae conpleverat annos haec iacet in tenebras quae vixit annis VI mensibus IIII diebus VII hora secunda hunc titu lum posuerunt parentes karissi mi","parens"
"EDCS-05400465","parens","paren(s|ti|te|tum)","le   et  ut  Fortunatae Ulpia Chia  parentibus dulcissimis","parens"
"EDCS-20800664","socer","socer","Dis Manibus sacrum Caius Agrius Dexter veteranus ex beneficiario tribuni vixit bene  annos LXXXII Caius Iulius Naestor veteranus gener socero simplicissimo fecit et dedicavit","socerus"
"EDCS-10301307","socer","socer","Lucio Caecilio Luci filio Caeciliano aedili IIviro flamini municipii Manlia Romana nurus socero piissimo posuit","socerus"
"EDCS-14801802","socer","socer","Tuticanae Sophe nurui sanctissimae Valerius Marinus socer","socer"
"EDCS-20800664","socer","socer","Dis Manibus sacrum Caius Agrius Dexter veteranus ex beneficiario tribuni vixit bene  annos LXXXII Caius Iulius Naestor veteranus gener socero simplicissimo fecit et dedicavit","socerus"
"EDCS-09201089","socer","socer","Dis Manibus Palladio Politice socera ponendum curavit genero pientissimo","socera"
"EDCS-08500340","socer","socer","Publio Vario Quinti filio Papiria Liguri Liciniae Cai libertae Thelide Publio Vario Publi filio Papiria Severo Variae Publi filiae Avitae de suo faciendum curavit   socero socrui socerino uxori de suo faciendum curavit sit vobis terra levis Iulia Quinti filia Severa hoc monumentum sive sepulcrum exterum heredem non sequetur","socerus"
"EDCS-15500043","socer","socer","Dis Manibus Tito Aelio Augusti liberto Tyranno qui fuit a commentariis provinciae Belgicae coniugi dulcissimo Aelia Andria uxor et Aelius Valerianus socer et Restitutus fecit colliberto","socer"
"EDCS-05800595","socer","socer","Dis Manibus sacrum Publio Avidio Trachalo praefecto cohortis item tribuno cohortis soceri genero optimo","soceror"
"EDCS-10500911","socer","socer","Dis Manibus Sexti Iuli Sexti filii Palatina Heli Titus Cassius Mysticus socer IIIIIIvir Augustalis Luguduni et Viennae genero sibi reveren tissimo et Callistus libertus IIIIIIvir Augustalis Luguduni patrono optimo et indulgentissimo","socer"
"EDCS-05503169","socer","socer","Dis Manibus Lucio Alfidio Urbano tribuno militum legionis VII Geminae Piae Felicis Antoninianae homini in vita sua optimo ex testamento eiusdem arbitrio Corneli Rusti ci soceri vive laetus quisque vivis vita parv lt u=O gt m mu nus est mox exorta est sen sim vigescit deinde sen sim deficit","socer"
"EDCS-08401482","coniugium","coniugi(um|i|o|a|orum|is)","Dis Manibus debita coniugio Apelles pia carmina scribit quam rapuit mors inimica viro haec debent memores  postrema in morte re ferre o requiem gratam quam pia cu ra dicat coniugis officium testatur car mine parvo extremum quae tibi refero munus Sempronia dulcis casta viro reve rens pia kara fidelis tot damna amissa coniuge iure fleo te lapis obtestor le viter super ossa quiescas et mediae aetati ne gravis esse velis Sextus Pompeius Apelles coniugi incomparabili","coniugium"
"EDCS-23200873","coniugium","coniugi(um|i|o|a|orum|is)","Dis Manibus Cai Sabini Urse homo optime ave Sabinia Myrtale patrono optimo et piissimo sibi carissimo cum quo vixit in coniugio annos LX ab excessu eius mense sexto posuit Urse homo optime vale","coniugium"
"EDCS-28100116","coniugium","coniugi(um|i|o|a|orum|is)","Vitalis Pieridi Luci Pomponi Pietatis vernae bene merenti Pieris hoc tumulo tegitur de matre Venusta sexto nata loco quae fuit a reliquis nondum viginti iuvenis compleverat annos quoi quoque virginitas nuper adempta fuit grataque florebat cunctis mortalibus aetas quam Fors ad superos noluit esse diu non pudor huic aberat pietas non grata parenti non amor in fratres eius avarus erat cara fuit mater fuerant caraeque sorores et pia coniugio grataque semper erat invita Pieridi cum venit letifera hora qua cubuit molli languida saepe toro hanc Atropos rapuit Lachesisque et tertia Clotho infelix mater tollit ad astra manus incusatque deos incusat denique Parcas quae vitam pensant quaeque futura canunt implerunt fratres magnis mugitibus auras et cuncti flebant nec minus ante rogum haec fuit at tumulum miserae vox ultima matris ossa simul vidit tabida Pieridis hanc humus excepit leviter precor illa prematque infantem ex utero quae quoque sustinuit coniunx Pieridi supremum munus amatae hunc titulum scripsit pro pietate sua","coniugio"
"EDCS-21300179","coniugium","coniugi(um|i|o|a|orum|is)","Dis Manibus sacrum Lucius Calpurnius Flamininus vivus sibi fecit oravi causas felix dum tertia non lux coniugium et natos omne decus rapuit vixit annis LXXV","coniugium"
"EDCS-04000994","coniugium","coniugi(um|i|o|a|orum|is)","Aureliae Mammosae ne multum quaeras hos pes cuius mon lt u=Y gt mentum Mammosae Florus con iugi constituit quam non inmerito mag no dilexit amore genialis custos utpote quae fuerit quaeque penum parvosque lares provexerit illi dum frugi vitam degerit ingenio et quae fecundo par tu numerosa replerit casta domum trino pig nore coniugii haec istic igitur miseran do funere rapta post annos florens vitae triginta duos coniugis haud minimo luctu sumptuque se pulta  si quis forte ve lis curiose sci re viator quis foret hic homi num quondam dum vita maneret Iulius hic fuerat serva to nomine Florus qui quinquaginta iu venis dum degeret annos atque unum pariter ingressus sorte fuisset infe lix facili decessit fu nere mortis huic ka ra quidem liberorum trina propago et casta pariter Mammosa nomine coniunx quam nunc ut rele gis defunctam morte  lt p=R gt riorem coniuncti tu muli sociato ser vat honore","coniugium"
"EDCS-15500185","coniugium","coniugi(um|i|o|a|orum|is)","  Caecilio M  et Caeciliae A  coniugio incomparabili et sui in exemplum temporis probatissi mo qui pariter sine ulla querella una vixerunt annos XXXIII dies XXV  Secundina parentibus","coniugium"
