"ID","Lemma (RegEx)","Regulärer Ausdruck","Text","Lemma (Latincy)"
"EDCS-60700127","coniugium","coniugi(um|i|o|a|orum|is)","uxoris     morum probitate    rum   permansisti proba   orbata es repente ante nuptiarum diem utroque parente in deserta soli tudine una occisis per te maxime cum ego in Macedoniam provinciam issem vir sororis tuae Caius Cluvius in Africam provinciam inulta non est relicta mors parentum tanta cum industria munere es pietatis perfuncta efflagitando atque vindicando ut si praesto fuissemus non amplius potuissemus sed haec habes communia cum sanctissima femina sorore tua quae dum agitabas ex patria domo propter custodiam non cedisti sumpto de nocentibus supplicio evestigio te in domum matris meae tulisti ubi adventum meum expectasti temptatae deinde estis ut testamentum quo nos eramus heredes ruptum diceretur coemptione facta cum uxore ita necessario te cum universis patris bonis in tutelam eorum qui rem agitabant reccidisse sororem omnino eorum bonorum fore expertem quod emancupata esset Cluvio qua mente ista acceperis qua prae sentia animi restiteris etsi afui conpertum habeo veritate causam communem tutata es testamentum ruptum non esse ut uterque potius hereditatem teneremus quam omnia bona sola possideres certa quidem sententia te ita patris acta defensuram ut si non optinuisses partituram cum sorore te adfir mares nec sub condicionem tutelae legit lt i=U gt mae venturam quoius per legem in te ius non esset neque enim familiae gens ulla probari poterat quae te id facere impediret nam etsi patris testamentum ruptum esset tamen iis qui intenderent non esse id ius quia gentis eiusdem non essent cesserunt constantiae tuae neque amplius rem sollicitarunt quo facto officii in patrem pietatis in sororem fidei in nos patrocinium su lt s=C gt ceptum sola peregisti rara sunt tam diuturna matrimonia finita morte non divertio interrupta contigit nobis ut ad annum XXXXI sine offensa perduceretur utinam vetusta coniunctio habu isset mutationem vice mea qua iustius erat cedere fato maiorem domestica bona pudicitiae o lt b=P gt sequi comitatis facilitatis lanificii studii religionis sine superstitione ornatus non conspicendi cultus modici cur memorem cur dicam de cari tate familiae pietate cum aeque matrem meam ac tuos parentes colueris non alia mente illi quam tuis curaveris cetera innumerabilia habueris communia cum omnibus matronis dignam famam colentibus propria sunt tua quae vindico ac paucae uxores in similia inciderunt ut talia paterentur et praestarent quae rara ut essent propitia fortuna cavit omne tu lt u=U gt m patrimonium acceptum ab parentibus communi diligentia conservavimus neque enim erat adquirendi tibi cura quod totum mihi tradisti officia ita par titi sumus ut ego tutelam tuae fortunae gererem ut meae custodiam sustineres multa de hac parte omittam ne tua propria mecum communicem satis sit hoc mihi tuis de sensibus indicasse liberalitatem tuam cum plur lt i=U gt mis necessariis tum praecipue pietati praestitisti   licet quis alias nominaverit unam dumtaxat simillimam tui     habuisti sororem tuam nam propinquas vestras dignas eiusmodi   beneficiis domibus vestris apud nos educavistis eadem ut condicio nes aptas familiae vestrae consequi possent dotes parastis quas quidem a vobis constitutas communi consilio ego et Caius Cluvius excepimus et probantes sensus vestros ne vestro patrimonio vos multaretis nostram rem familiarem subdidimus vestrae nostraque bona in dotes dedimus quod non venditandi nostri causa memoravi sed ut illa consilia vestra concepta pia liberalitate honori nos duxisse consta ret exequi de nostris multa alia merita tua praetermittenda mihi sunt  varia et ampla subsidia fugae meae praestitisti ornamentis me instruxisti cum omne aurum margaritaque corpori tuo accomodata tradisti mihi et subinde familia nummis fructibus deceptis nostrorum adversariorum custodibus a lt b=P gt sentiam meam locupletasti publicatis bonis repetitis  quod ut conarere virtus tua te hortabatur mira pietas tua me munibat clementia eorum contra quos ea parabas nihilo minus tamen vox tua est firmitate animi emissa agmen conlectum ex repertis hominibus a Milone quoius domus emptione potitus eram cum ille fuisset exul belli civilis occasonibus inrupturum et direpturum   reiecisti et defendisti domum nostram   iure Caesar dixit tibi acceptum esse referendum extare adhuc me patriae redditum a se nam nisi parasses quod servaret cavens saluti meae inaniter opes suas polliceretur ita non minus pietati tuae quam Caesari me debeo quid ego nunc interiora nostra et recondita consilia sermonesque arcanos eruam ut repentinis nuntiis ad praesentia et i lt m=N gt minentia pericula evoca tus tuis consiliis conservatus sim ut neque audacius experiri casus temere passa sis et modestiora cogitanti fida receptacula pararis sociosque consiliorum tuorum ad me servandum delegeris sororem tuam et virum eius Caium Cluvium coniuncto omnium periculo infinita sint si attingere coner sat sit mihi tibique salutariter me latuisse acerbissumum tamen in vita mihi accidisse tua vice fatebor reddito me iam cive patriae beneficio et iudicio a lt b=P gt sentis Caesaris Augusti quom abs te   de restitutione mea Marcus Lepidus conlega praesens interpellaretur et ad eius pedes prostrata humi non modo non adlevata sed traducta et indignum in modum rapsata livoribus corporis repleta firmissimo animo eum admone res edicti Caesaris cum gratulatione restitutionis meae atque vocibus eti am contumeliosis et crudelibus exceptis volneribus palam conquereris ut auctor meorum periculorum notesceret quoi nocuit mox ea res quid hac virtute efficacius praebere Caesari clementiae locum et cum cu stodia spiritus mei notare i lt m=N gt portunam crudelitatem Lepidi firma tua patientia sed quid plura parcamus orationi quae debet et potest esse brevis ne maxi ma opera tractando parum digne peragamus quom pro maximo documento meritorum tuorum oculis omnium praeferam titulum salutis meae pacato orbe terrarum restituta re publica quieta deinde nobis et felicia tempora contingerunt fuerunt optati liberi quos aliquamdiu sors nobis invi derat si fortuna procedere esset passa sollemnis inserviens quid utrique no strum defuit procedens alias spem finiebat quid agitaveris propterea quae que ingredi conata sis fors sit an in quibusdam feminis conspicua et memorabi lia in te quidem minime admiranda conlata virtutibus ceteris omittam diffidens fecunditati tuae et dolens orbitate mea ne tenendo in matrimonio te spem habendi liberos deponerem atque eius caussa essem infelix de divertio elocuta es vocuamque domum alterius fecunditati te tradituram non alia mente nisi ut nota concordia nostra tu ipsa mihi dignam et aptam con dicionem quaereres pararesque ac futuros liberos te communes pro que tuis habituram adfirmares neque patrimonii nostri quod adhuc fuerat commune separationem facturam sed in eodem arbitrio meo id et si vellem tuo ministerio futurum nihil seiunctum nihil separatum te habituram sororis socrusve officia pietatemque mihi dehinc praestituram fatear necesset adeo me exarsisse ut excesserim mente adeo exhoruisse cona tus tuos ut vix redderer mihi agitari divertia inter nos ante quam nobis fato dicta lex esset posse te aliquid concipere mente quare vivo me desineres esse mihi uxor cum paene exule me vita fidiss lt i=U gt ma permansisses quae tanta mihi fuerit cupiditas aut necessitas habendi liberos ut propterea fidem exuerem mutarem certa dubiis sed quid plura cedens mihi mansisti apu lt d=T gt  me neque enim cedere tibi sine dedecore meo et communi infelici tate poteram tibi vero quid memorabilius quam inserviendo mihi consilium cepisse ut quom ex te liberos habere non possem per te tamen haberem et diffi dentia partus tui alterius coniugio parares fecunditatem utinam patiente utriusque aetate procedere coniugium potuisset donec e lato me maiore quod iustius erat suprema mihi praestares ego enim super stite te excederem orbitate filia mihi su lt b=P gt stituta praecucurristi fato delegasti mihi luctum desiderio tui nec liberos futuros me mise rum reliquisti flectam ego quoque sensus meos ad iudicia tua omnia tua cogitata praescripta cedant laudibus tuis ut sint mihi solacia ne nimis desiderem quod inmortalitati ad memoriam consecratum est fructus vitae tuae non derunt mihi occurrente fama tua firmatus animo atque doctus actis tuis resistam fortunae quae mihi non omnia eripuit sed cum laudi bus crescere tui memoriam passa est sed quod tranquilli status erat mihi tecum amisi quam speculatricem et propugnatricem meorum periculorum cogitans calami tate frangor nec permanere in promisso possum naturalis dolor extorquet constantiae vires maerore mersor et quibus angos luctu aedioque in necutro mihi consto repetens pristinos casus meos futurosque eventus cogitans con cido mihi tantis talibusque praesidiis orbatus intuens famam tuam non tam constanter pa tiendo haec quam ad desiderium luctumque reservatus videor ult lt i=U gt mum huius orationis erit omnia meruisse te neque omnia contigisse mihi ut praestarem tibi legem habui mandata tua quod extra mihi liberum fuerit praestabo te di Manes tui ut quietam patiantur atque ita tueantur opto","coniugium"
"EDCS-20403320","coniugium","coniugi(um|i|o|a|orum|is)","Dis Manibus sacrum Clodiae Se cundae coniu gi dulcissimae et bene merenti quae vixit annis XXV mensibus X diebus XIIII in coniugio mecum fuit si ne querella annis VII mensibus IIII diebus XVIII Lucius Caelius Flo rentinus |centurio cohortis X urbanae posuit natus Mamertino et Rufo consulibus pridie Nonas Augustas defuncto XV Kalendas Iulias Apro et Ma ximo  consulibus","coniugium"
"EDCS-26600231","coniugium","coniugi(um|i|o|a|orum|is)","Aurelius Ianuarius beneficiarius tri buni Valeriae Lucillae con iugi pientissimae quae vixit annos XX in se coniugio fuerunt annis III quae reliquit filium Aurelium Maximi num annorum duum ob memo riae defuncti  L I  smaes","coniugio"
"EDCS-21300179","coniugium","coniugi(um|i|o|a|orum|is)","Dis Manibus sacrum Lucius Calpurnius Flamininus vivus sibi fecit oravi causas felix dum tertia non lux coniugium et natos omne decus rapuit vixit annis LXXV","coniugium"
"EDCS-72900004","conubium","conubi","legato quinis et vicenis pluribusve stipendiis emeritis dimissis honesta missione quorum nomina subscripta sunt civitatem Romanam qui eorum non haberent dedit et conubium cum uxoribus quas tunc habuissent cum est civitas iis data aut cum iis quas postea duxissent dumtaxat singulis","conubium"
"EDCS-12200001","conubium","conubi","Imperator Caesar Marcus Aurelius Antoninus Augustus Armenia cus pontifex maximus tribunicia potestate XVIII imperator II consul III et Imperator Caesar Lucius Aurelius Antoninus Augustus Armeniacus tribunicia potestate IIII imperator II proconsul consul II divi Antonini filii divi Ha driani nepotes divi Traiani Parthici pronepotes divi Nervae abnepotes equitibus et peditibus qui militaverunt in alis III quae appellantur II Gallorum et Pannoniorum et Siliana civium Romanorum et I Tungrorum Frontoniana et cohortibus XII Brittonum |miliaria et I Britannorum equitata et I Hispanorum |miliaria et I Batavorum |miliaria et Aelia Gaesatorum II Nervia Brit tonum |miliaria et I Britannorum |miliaria et I Hispanorum |miliaria et I Canna nefatium et II Hispanorum et V Lingonum et III Thracum et sunt in Dacia Porolisensi sub Sempronio Ingenuo procuratore quinis et vicenis pluribusve stipendiis emeritis dimissis honestis missione quorum nomina sub scripta sunt civitatem Romanam qui eorum non haberent dederunt et conubium cum uxoribus quas tunc ha buissent cum est civitas iis data aut cum iis quas postea duxissent dumtaxat singulis  Ante diem XII Kalendas Augustas Saturnino et Avito consulibus alae Silianae civium Romanorum cui praeest Aurelius Atilianus ex gregale Acilio Sabini filio Dubitato Castris descriptum et recognitum ex tabula aerea quae fixa est Romae in muro post templum divi Augusti ad Minervam  Imperator Caesar Marcus Aurelius Antoninus Augustus Armeniacus pontifex maximus tri bunicia potestate XVIII imperator II consul III et Imperator Caesar Lucius Aurelius Verus Augustus Ar meniacus tribunicia potestate IIII imperator II proconsul consul II divi Antonini filii divi Hadriani nepoptes divi Traiani Parthici pronepotes divi Nervae abnepotes equitibus et peditibus qui militaverunt in alis tribus quae appellantur II Gallorum et Pannoniorum et Siliana civium Romanorum et I Tungrorum Frontoniana et cohortibus decem et duabus I Brittonum |miliaria et I Britannorum equitata et I Hispanorum |miliaria et I Batavorum |miliaria et I Aelia Gaesatorum et II Nervia Brittonum |miliaria et II Britannorum |miliaria et I Hispanorum |miliaria et I Cannanefatium et II Hispanorum et V Lingonum et VI Thracum et sunt in Dacia Porolissensi sub Sempronio Ingenuo procuratore quinis et vicenis pluribusve stipendiis emeritis dimissis honesta missione quorum nomina subscripta sunt ci vitatem Romanam qui eorum non haberent dederunt et conubium cum uxoribus quas tunc habuissent cum est civitas iis data aut cum iis quas pos tea duxissent dumtaxat singu lis ante diem XII Kalendas Augustas Tiberio Haterio Saturnino Quinto Caecilio Avito consulibus alae Silianae civium Romanorum cui praeest Aurelius Atilianus ex gregale Acilio Sabini filio Dubitato Castris descriptum et recognitum ex tabula aerea quae fixa est Romae in muro post templum divi Augusti ad Minervam  Marci Servili Getae Tiberi Iuli Felicis Cai Belli Urbani Luci Pulli Primi Luci Senti Chrysogoni Cai Pomponi Statiani Luci Pulli Zosimi","conubium"
"EDCS-46400293","conubium","conubi","quorum nomina subscripta sunt ipsis liberis posterisque eorum civitatem dedit et conubium cum uxoribus quas tunc habuissent cum est civitas iis data aut si qui caelibes essent cum iis quas postea duxissent dumtaxat singuli singulas ante diem VIII Kalendas Ianuarias Caio Herennio Capella Lucio Coelio Rufo consulibus  quorum nomina subscripta sunt ipsis liberis posterisque eorum civitatem dedit et conubium cum uxoribus quas tunc habuissent","conubium"
"EDCS-44200012","conubium","conubi","Imperator Caesar divi Vespasiani filius Domitianus Augustus Germanicus pontifex maximus tribunicia potestate VIII imperator XVII consul XIIII censor perpetuus pater patriae equitibus et peditibus qui militant in alis tribus et cohortibus decem et septem quae appellantur II Pannoniorum III Augusta Thracum veterana Gallica I Flavia civium Romanorum I miliaria I Lucensium I Ascalonitanorum I Sebastena I Ituraeorum I Numidarum II Italica civium Romanorum II Thracum civium Romanorum II classica III Augusta Thracum III Thracum Syriaca IIII Bracaraugustanorum IIII Syriaca IIII Callaecorum Lucensium Augusta Pannoniorum Musulamiorum et sunt in Syria sub Publio Valerio Patruino qui quina et vicena stipendia aut plura meruerant quorum nomina subscripta sunt ipsis liberis posterisque eorum civitatem dedit et conubium cum uxoribus quas tunc habuissent cum est civitas iis data aut si qui caelibes essent cum iis quas postea duxissent dumtaxat singuli singulas ante diem VII Idus Novembres Manio Otacilio Catulo Sexto Iulio Sparso consulibus","conubium"
"EDCS-48900585","conubium","conubi","Imperator Caesar divi Hadriani filius divi Traia ni Parthici nepos divi Nervae pronepos Titus Aelius Hadrianus Antoninus Augustus Pi us pontifex maximus tribunicia potestate XIV imperator II consul IV pater patriae iis qui militaverunt in classe prae toria Ravennate quae est sub Tattio Maximo sex et viginti stipendiis emeritis dimissis honesta mis sione quorum nomina subscri lt p=C gt ta sunt ipsis liberis posterisque eorum civitatem Romanam dedit et conubium cum uxoribus quas tunc habuissent cum est civitas iis data   nomina subscripta sunt ipsis liberis posterisque eorum civitatem Romanam dedit et conubium cum uxoribus quas tunc habuissent cum iis quas postea duxissent dumtaxat sin guli singulas","conubium"
"EDCS-36300007","conubium","conubi","Imperator Caesar divi Hadriani filius divi Traiani Pa lt r=I gt thici nepos divi Nervae pronepos Titus Aelius Ha drianus Antoninus Augustus Pius pontifex maximus tribunicia potestate XX imperator II consul IIII pater patriae equitibus et peditibus qui militaverunt in alis II quae appellantur Claudia nova miscellanea et Gallorum Flaviana et cohortibus X V Gallorum Pannonica  et V Hispanorum et I Montanorum et I Antiochensium sagittaria et I Cretum sagittaria et III Campestris civium Romanorum et II Gallorum Pannonica et III Brittonum veterana et I Lusitanorum et I Pannoniorum veterana et sunt in Moesia superiore sub Curtio Iusto legato quinque et viginti stipendiis emeritis dimissis honesta missione quorum nomina subscripta sunt civitatem Romanam qui eorum non haberent dedit et conubium cum uxo ribus quas tunc habuissent cum est civitas iis data aut cum iis quas postea duxissent dumtaxat singulis ante diem VIIII Kalendas Maias Lucio Roscio Aeliano Cnaeo Papirio Aeliano consulibus cohortis III Brittonum veteranae cui praeest Quintus Clodius Secundus ex pedite Himero Callistrati filio Laud  Imperator Caesar divi Hadriani filius divi Traiani Parthici nepos divi Nervae pronepos Titus Aelius Hadrianus Antoninus Augustus Pius pontifex maximus tribunicia potestate XX imperator II consul IIII pater patriae equitibus et peditibus qui militaverunt in alis II quae appellantur Claudia nova miscellanea et Gallorum Flaviana et cohortibus X V Gallorum Pannonica  et V Hispanorum et I Montanorum et I Antiochensium sagittaria et I Cretum sagittaria et III Campestris civium Romanorum et II Gallorum Pannonica et III Brittonum veterana et I Lusitanorum et I Pannoniorum veterana et sunt in Moesia superiore sub Curtio Iusto legato quinque et viginti stipendiis emeritis dimissis honesta missione quorum nomina subscripta sunt civitatem Romanam qui eorum non haberent dedit et conubium cum uxo ribus quas tunc habuissent cum est civitas iis data aut cum iis quas postea duxissent dumtaxat singulis ante diem VIIII Kalendas Maias Lucio Roscio Aeliano Cnaeo Papirio Aeliano consulibus cohortis III Brittonum veteranae cui praeest Quintus Clodius Secundus ex pedite Himero Callistrati filio Laud descriptum et recognitum ex tabula aerea quae fixa est Romae in muro post templum divi Augusti ad Minervam  Marci Servili Getae Luci Pulli Chresimi Marci Sentili Iasi Tiberi Iuli Felicis Cai Belli Urbani Cai Pomponi Statiani Publi Ocili Prisci","conubium"
"EDCS-12300212","conubium","conubi","Servius Galba Imperator Caesar Au lt g=C gt ustus pontifex maximus tribunicia potestate consul designatus II veteranis qui militaverunt in le lt g=C gt ione I Adiutrice honestam missionem et civitatem dedit quorum nomina sub scripta sunt ipsis liberis posterisque eorum et conubium cum uxoribus quas tunc habuissent cum est civitas iis data aut si qui caelibes essent cum iis quas postea duxissent dumtaxat singuli singulas ante diem  XI Kalendas Ianuarias Caio Bellico Natale Publio Cornelio Scipione consulibus Diomedi Artemonis filio Phrygio descriptum et recognitum ex tabula ae nea quae fixa est Romae in Capitolio in ara gentis Iuliae  Servius Galba Imperator Caesar Augustus pontifex maximus tribunicia potestate consul designatus II veteranis qui militaverunt in legion lt e=I gt  I Adiutrice honestam missionem et civi tatem dedit quorum nomina subscripta sunt ipsis liberis posterisque eorum et conubium cum uxoribus quas tunc habuissent cum est civitas iis data aut si qui caelibes essent cum iis quas postea duxissent dumtaxat singuli singulas ante diem XI Kalendas Ianuarias Caio Bellico Natale Publio Cornelio Scipione consulibus Diomedi Artemonis filio Phrygio Laudicea descriptum et recognitum ex tabula aenea  quae fixa est Romae in Capitolio in ara gentis Iuliae  Tiberius Iulius Pardala Sardianus Cai Iuli Charmi Sardiani Tiberi Claudi qui Fidini Maeo niani Cai Iuli Cai filii Collina Libonis Sardiani Tiberius Fonteius Cerialis Sardianus Publi Gra lt t=L gt ti Publi filii Aemilia Provin cialis ipsius Marci Arri Rufi Sardiani","conubium"
"EDCS-12300367","conubium","conubi","Imperator Caesar divi Nervae filius Nerva Traianus Augustus Germanicus Dacicus pontifex maximus tribunicia potestate XIIII imperator VI consul V pater patriae iis qui militaverunt equites et pedites in alis quattuor et cohortibus decem et octo quae appellantur I Augusta Ituraeorum et I Claudia et I Britannica civium Romanorum et II Pannoniorum veterana et I Brittonum |miliaria Ulpia torquata civium Romanorum et I Vinde licorum |miliaria civium Romanorum Pia Fidelis et I Britannica |miliaria civium Romanorum et I Flavia  lt H=II gt is panorum |miliaria et I Montanorum et I Thracum civium Romanorum et I Cre tum sagittariorum et I Hispanorum Pia Fidelis et I Panno nio lt r=Q gt um veterana Pia Fidelis et II Hispanorum et II Britannorum |miliaria civium Romanorum Pia Fidelis et II Gallorum Pannonica et II Gallorum Mace donica et II Flavia Commagenorum sagittariorum et V Lingonum et V Gallorum et VI Thracum et VIII Raetorum civium Romanorum et pedites Britannici et sunt in Dacia sub Decimo Terentio Scauriano qui nis et vicenis pluribusve stipendiis eme ritis dimissis honesta missione quo rum nomina subscripta sunt ipsis liberis poste risque eorum civitatem dedit et conubium cum uxoribus quas tunc habuissent cum est civitas iis data autsi qui caelibes essent cum iis quas postea duxissent dumtaxat singuli  singulas ante diem VI Nonas Iulias Caio Eruciano Silone Lucio Catilio Severo consulibus cohortis I Brittonum Ulpiae |miliariae torquatae civium Romanorum cui praeest Marcus Aemilius Bassus ex pedite Marco Ulpio Sacci filio Longino Belgo et Vitali filio eius descriptum et recognitum ex tabula aenea quae fixa est Romae  Imperator Caesar divi Nervae filius Nerva Traianus Augustus Germanicus Dacicus pontifex maximus tribunicia potestate XIIII imperator VI consul V pater patriae iis qui militaverunt equites et pedites in alis quat tuor et cohortibus decem et octo quae appellantur I Augusta Ituraeorum et I Claudia et I Britannica civium Romanorum et II Pannoniorum veterana et I Brittonum |miliaria Ulpia tor quata civium Romanorum et I Vindelicorum |miliaria civium Romanorum Pia Fidelis et I Britannica |miliaria civium Romanorum et I Flavia Hispanorum |miliaria et I Montanorum et I Thracum civium Romanorum et I Cretum sagittariorum et I Hispanorum Pia Fidelis et I Pannoniorum veterana Pia Fidelis et II Hispanorum et II Britannorum |miliaria civium Romanorum Pia Fidelis et II Gallorum Pannonica et II Gallorum Macedonica et II Flavia Commagenorum sagittariorum et V Lingonum et V Gallorum et VI Thracum et VIII Raetorum civium Romanorum et pedi tes Britannici et sunt in Dacia sub Decimo Terentio Scauri ano quinis et vicenis pluribusve stipendiis emeritis dimissis honesta missione quorum nomina sub scripta sunt ipsis liberis posterisque eorum civi tatem dedit et conubium cum uxoribus quas tunc habuissent cum est civitas iis data aut si qui cae libes essent cum iis quas postea duxissent dum taxat singuli singulas ante diem VI Nonas Iulias Caio Eruciano Silone Lucio Catilio Severo consulibus cohortis I Brittonum |miliariae Ulpiae torquatae civium Romanorum cui praeest Marcus Aemilius Bassus ex pedite Marco Ulpio Sacci filio Longino Belgo et Vitali filio eius descriptum et recognitum ex tabula aenea quae fixa est Romae in muro post templum divi Augusti ad Minervam  Publi Corneli Alexandri Luci Pulli Verecundi Publi Atini Amerimni Luci Pulli Trophimi Cai Tuticani Saturnini Cai Iuli Parati Marci Iuni Eutychi","conubium"
"EDCS-12100827","conubium","conubi","Imperator Caesar divi Hadriani filius divi Traiani Parthici nepos divi Nervae pronepos Titus Aelius Hadrianus Antoninus Augustus Pius pontifex maximus tribunicia potestate   imperator II consul IV pater patriae equitibus et peditibus qui militaverunt in alis V quae appellantur I Gallorum et Pannoniorum et I Gallorum Ate ctorigiana et II Hispanorum Aravacorum et I Vespasiana Dardanorum et   et cohortibus XI I Bracaraugustanorum et I Flavia Numidarum et   et I Sugambrorum veterana et I Lusitanorum Cyrenaica et II Chalcidenorum sagittaria et I Cilicum sagittaria et I Thracum Syriaca et I Germanorum civium Romanorum et II Bracaraugustanorum et   et sunt in Moesia inferiore sub Vi trasio Pollione legato quinque et viginti st ipendiis dimissis honesta missione quorum nomina subscripta sunt civitatem Romanam qui eorum non haberent  et I Sugambrorum veterana et I Lu sitanorum C lt y=V gt renaica et II Chalcidenorum sagittaria et I Cilicum sagittaria et I Thracum S lt y=V gt riaca et I Germanorum civium Romanorum et II Bracaraugustanorum et   et sunt in Moesia inferiore sub Vitrasio Pol lione legato XXV stipendiis dimissis honesta missione quorum nomina subscripta sunt civitatem Romanam qui eorum non haberent dedit et conubium cum uxoribus quas tunc habuissent cum est ci vitas iis data aut cum iis quas postea du xissent dumtaxat singulis","conubium"
